sku,producto,categoria,precio,precio_lista,stock,url,descripcion
33967,MIXER IBA10 ELECTROLUX,78,11899.15,13999.0,1,https://www.hiperlibertad.com.ar/mixer-electrolux-iba10/p,MIXER IBA10 ELECTROLUX
33954,LIMPIADOR A VAPOR ELECTROLUX MOP10 1300 W 350 Ml,103,15299.1,16999.0,2,https://www.hiperlibertad.com.ar/limpiador-a-vapor-electrolux-mop10-1300-w-350-ml/p,"Limpia, Desinfecta Y Remueve La Grasa De Todos Los Tipos De Pisos (Laminados, Cerámicos, Vinílicos Y Alfombras), Devolviendo El Brillo Y La Apariencia De Nuevo. El Reservorio De Agua Con Capacidad De 350ml Garantiza Una Autonomía De Hasta 25 Minutos De Vapor Continuo. Esta mopa limpiadora posee 1300 Watts de potencia, regulador de potencia, tubos de acero inoxidable y enrollacable"
33290,CALEF ESKABE S21 MX8P 8000 S/S,73,39999.0,39999.0,1,https://www.hiperlibertad.com.ar/calefactor-eskabe-siglo-21-s21-mx8p-8000-kcal/p,CALEF ESKABE S21 MX8P 8000 S/S
33673,TABLET SKY KIDS AMARILLO,55,19999.0,19999.0,4,https://www.hiperlibertad.com.ar/tablet-sky-kids-amarillo/p,Pantalla: 7´´ - Resolución: 600x1024 px - Núcleos de procesador: 4 - GPU: Quad Core 1.5 GHz - Memoria: 1 GB - Almacenamiento: 16 GB - WiFi: 4G- Cámara principal: 5 MP - Cámara frontal: 2 MP - Sistema operativo: Android 11 - Batería: 2400 mAh - CONTENIDO DE LA CAJA: - Cargador tipo C - Funda de silicona resistente con pie - Manual de Usuario
34631,"SMART TV TCL 55"" PULGADAS L55P725 4K UHD",34,150518.0,150518.0,1,https://www.hiperlibertad.com.ar/smart-tv-tcl-55-pulgadas-l55p725-4k-uhd/p,"<p style=""text-align: center;"">&nbsp; &nbsp; &nbsp;</p>
<p style=""text-align: center;""><strong>Conect&aacute; tus dispositivos</strong><br />Mediante sus entradas HDMI pod&eacute;s vincular reproductores de audio y video; consolas de juegos y notebooks. Su gran capacidad de transmisi&oacute;n de datos permite disfrutar de im&aacute;genes en alta definici&oacute;n y un sonido de gran fidelidad. Tambi&eacute;n, a trav&eacute;s de su puerto USB, podr&aacute;s reproducir contenido multimedia (m&uacute;sica, fotos y videos) almacenado en tus dispositivos externos como tablets, smartphones y pendrives.</p>
<p style=""text-align: center;""><strong>Naveg&aacute; por la web</strong><br />Gracias a que viene con Wi-Fi incorporado vas a poder acceder a internet de forma inal&aacute;mbrica o bien, a trav&eacute;s de cable de red mediante su puerto LAN. Disfrut&aacute; de tus app preferidas como Netflix y YouTube, entre otras.</p>
<p style=""text-align: center;""><strong>Disfrut&aacute; 4K UHD</strong><br />El smart TV TCL L55P725-F de 55 pulgadas posee una pantalla de visualizaci&oacute;n LED de formato widescreen (16:9) y resoluci&oacute;n 4K UHD 3840 x 2160 p&iacute;xeles.</p>
<p style=""text-align: center;""><span><strong>&nbsp;</strong><br /><strong>Caracter&iacute;sticas T&eacute;cnicas</strong><br /><strong>Imagen</strong><br />Pulgadas 55<br />Resoluci&oacute;n 3840 x 2160 p&iacute;xeles<br />Formato de pantalla Plano<br />3D No<br /><br /><strong>Caracter&iacute;sticas Generales</strong><br /><br /><strong>Caracteristicas Smart</strong><br />Youtube<br />Netflix<br />Conectividad<br />Entradas HDMI 3<br />Entradas USB 2<br />Conexi&oacute;n a Internet S&iacute;<br />HDMI ARC S&iacute;<br /><br />&nbsp;<br /><strong>Dimensiones</strong><br />Alto 72,4 cm<br />Ancho 123,4 cm<br />Profundidad 8,6 cm<br />Alto (con base) 77,4 cm<br />Ancho (con base) 123,4 cm<br />Profundidad (con base) 26,5 cm<br />Medida VESA 200 x 300<br />Peso 11 Kg<br /><br /></span></p>"
34054,ACONDICIONADOR PLUSBELLE DOCILIDAD X 1000 Ml,420,329.0,329.0,3,https://www.hiperlibertad.com.ar/acondicionador-plusbelle-docilidad-x-1000-ml/p,ACONDICIONADOR PLUSBELLE DOCILIDAD X 1000 Ml
34055,ACONDICIONADOR PLUSBELLE PROTECCION X 1000 Ml,420,329.0,329.0,1,https://www.hiperlibertad.com.ar/acondicionador-plusbelle-proteccion-x-1000-ml/p,ACONDICIONADOR PLUSBELLE PROTECCION X 1000 Ml
34060,ACONDICIONADOR PLUSBELLE SUAVIDAD X 1000 Ml,420,578.14,578.14,27,https://www.hiperlibertad.com.ar/acondicionador-plusbelle-suavidad-x-1000-ml/p,ACONDICIONADOR PLUSBELLE SUAVIDAD X 1000 Ml
34061,ACONDICIONADOR PLUSBELLE FRESCURA X 1000 Ml,420,329.0,329.0,7,https://www.hiperlibertad.com.ar/acondicionador-plusbelle-frescura-x-1000-ml/p,ACONDICIONADOR PLUSBELLE FRESCURA X 1000 Ml
36832,SHAMPOO ELVIVE DREAM LONG X 200 Ml,421,551.0,551.0,9,https://www.hiperlibertad.com.ar/shampoo-elvive-dream-long-x-200-ml/p,SHAMPOO ELVIVE DREAM LONG X 200 Ml
36800,SHAMPOO ELVIVE OLEO EXTRAORDINARIO RIZOS DEFINIDOS X 200 Ml,421,551.0,551.0,9,https://www.hiperlibertad.com.ar/shampoo-elvive-oleo-extraordinario-rizos-definidos-x-200-ml/p,SHAMPOO ELVIVE OLEO EXTRAORDINARIO RIZOS DEFINIDOS X 200 Ml
34278,SHAMPOO ELVIVE DREAM LONG X 400 Ml,421,880.0,880.0,10,https://www.hiperlibertad.com.ar/shampoo-elvive-dream-long-x-400-ml/p,SHAMPOO ELVIVE DREAM LONG X 400 Ml
34277,ACONDICIONADOR ELVIVE OLEO DE COCO NUTRICION INTENSA X 400 Ml,420,880.0,880.0,16,https://www.hiperlibertad.com.ar/acondicionador-elvive-oleo-de-coco-nutricion-intensa-x-400-ml/p,ACONDICIONADOR ELVIVE OLEO DE COCO NUTRICION INTENSA X 400 Ml
34405,SHAMPOO ELVIVE OLEO EXTRAORDINARIO RIZOS DEFINIDOS X 400 Ml,421,880.0,880.0,1,https://www.hiperlibertad.com.ar/shampoo-elvive-oleo-extraordinario-rizos-definidos-x-400-ml/p,SHAMPOO ELVIVE OLEO EXTRAORDINARIO RIZOS DEFINIDOS X 400 Ml
33746,CHOCOLATE VIZZIO NUGATON X 100 Gr,354,471.0,471.0,119,https://www.hiperlibertad.com.ar/chocolate-vizzio-nugaton-x-100-gr/p,CHOCOLATE VIZZIO NUGATON X 100 Gr
33754,CHOCOLATE CON LECHE VIZZIO CON PASAS X 100 Gr,351,471.0,471.0,61,https://www.hiperlibertad.com.ar/chocolate-con-leche-vizzio-con-pasas-x-100-gr/p,CHOCOLATE CON LECHE VIZZIO CON PASAS X 100 Gr
34312,CHOCOLATE VIZZIO BLANCO X 50 Gr,354,240.0,240.0,762,https://www.hiperlibertad.com.ar/chocolate-vizzio-blanco-x-50-gr/p,CHOCOLATE VIZZIO BLANCO X 50 Gr
33720,CHOCOLATE VIZZIO 60% CACAO X 130 Gr,354,671.99,671.99,109,https://www.hiperlibertad.com.ar/chocolate-vizzio-60-cacao-x-130-gr/p,CHOCOLATE VIZZIO 60% CACAO X 130 Gr
34359,CHOCOLATE VIZZIO 60% CACAO X 50 Gr,354,289.0,289.0,899,https://www.hiperlibertad.com.ar/chocolate-vizzio-60-cacao-x-50-gr/p,CHOCOLATE VIZZIO 60% CACAO X 50 Gr
33745,CHOCOLATE VIZZIO LECHE X 130 Gr,354,544.99,544.99,257,https://www.hiperlibertad.com.ar/chocolate-vizzio-leche-x-130-gr/p,CHOCOLATE VIZZIO LECHE X 130 Gr
34623,CHOCOLATE VIZZIO CON LECHE X 50 Gr,354,241.0,241.0,644,https://www.hiperlibertad.com.ar/chocolate-vizzio-con-leche-x-50-gr/p,CHOCOLATE VIZZIO CON LECHE X 50 Gr
28858,TOALLAS PARA INCONTINENCIA LINA ANATOMICAS X 8 U,446,274.99,274.99,80,https://www.hiperlibertad.com.ar/toallas-para-incontinencia-lina-anatomicas-x-8-u/p,TOALLAS PARA INCONTINENCIA LINA ANATOMICAS X 8 U
31229,POSTRE EXQUISTA DULCE DE LECHE LIGHT X 60 Gr,372,175.0,175.0,125,https://www.hiperlibertad.com.ar/postre-exquista-dulce-de-leche-light-x-60-gr/p,POSTRE EXQUISTA DULCE DE LECHE LIGHT X 60 Gr
31067,MOUSSE EXQUISITA CHOCOLATE NOUGAT X 95 Gr,372,204.0,204.0,38,https://www.hiperlibertad.com.ar/mousse-exquisita-chocolate-nougat-x-95-gr/p,MOUSSE EXQUISITA CHOCOLATE NOUGAT X 95 Gr
29814,MOUSSE EXQUISITA DULCE DE LECHE GRANIZADO X 95 Gr,372,197.0,197.0,106,https://www.hiperlibertad.com.ar/mousse-exquisita-dulce-de-leche-granizado-x-95-gr/p,MOUSSE EXQUISITA DULCE DE LECHE GRANIZADO X 95 Gr
30323,POSTRE EXQUISITA LIGHT CHOCOLATE X 65 Gr,372,175.0,175.0,185,https://www.hiperlibertad.com.ar/postre-exquisita-light-chocolate-x-65-gr/p,POSTRE EXQUISITA LIGHT CHOCOLATE X 65 Gr
30330,CAFE TORRADO MOLIDO LA MORENITA CLASICO X 1 Kg,339,2279.0,2279.0,1,https://www.hiperlibertad.com.ar/cafe-torrado-molido-la-morenita-clasico-x-1-kg/p,CAFE TORRADO MOLIDO LA MORENITA CLASICO X 1 Kg
28463,GIN HENDRICKS X 700 Ml,414,14778.0,14778.0,2,https://www.hiperlibertad.com.ar/gin-hendricks-x-700-ml/p,GIN HENDRICKS X 700 Ml
29819,STEVIA LEDESMA CERO X 96 SOBRES,337,465.74,620.99,17,https://www.hiperlibertad.com.ar/stevia-ledesma-cero-x-96-sobres/p,STEVIA LEDESMA CERO X 96 SOBRES
30331,STEVIA LEDESMA CERO X 48 SOBRES,337,411.99,411.99,32,https://www.hiperlibertad.com.ar/stevia-ledesma-cero-x-48-sobres/p,STEVIA LEDESMA CERO X 48 SOBRES
31234,STEVIA LEDESMA CERO X 198 SOBRES,337,1300.0,1300.0,10,https://www.hiperlibertad.com.ar/stevia-ledesma-cero-x-198-sobres/p,STEVIA LEDESMA CERO X 198 SOBRES
30327,ENJUAGUE BUCAL LISTERINE CUIDADO TOTAL X 500 Ml,427,1264.0,1264.0,25,https://www.hiperlibertad.com.ar/enjuague-bucal-listerine-cuidado-total-x-500-ml/p,"LISTERINE® CUIDADO TOTAL Frescura Intensa. 
Fórmula exclusiva con agentes antibacterianos que eliminan hasta el 99,9% de los gérmenes que causan placa, gingivitis y mal aliento en solo 30 segundos. 
La innovadora combinación de los cuatro aceites esenciales de LISTERINE® (Timol, Eucaliptol, Mentol y Salicilato de Metilo) actúa sobre las bacterias escondidas en lo más profundo de la boca.
Con flúor y Zinc activos. La protección más avanzada de la línea contra  la caries, sarro y cuidado de las encías.
Odontológicamente comprobado.

* vs solo cepillado."
28955,Enjuague Bucal LISTERINE® FRESHBURST Frescura Intensa x500mL,427,991.99,991.99,20,https://www.hiperlibertad.com.ar/enjuague-bucal-listerine-freshburst-frescura-intensa-x500ml/p,"LISTERINE® FRESHBURST Frescura Intensa. 
Fórmula exclusiva con agentes antibacterianos que eliminan hasta el 99,9% de los gérmenes que causan placa, gingivitis y mal aliento en solo 30 segundos. 
La innovadora combinación de los cuatro aceites esenciales de LISTERINE® (Timol, Eucaliptol, Mentol y Salicilato de Metilo) actúa sobre las bacterias escondidas en lo más profundo de la boca.
Odontológicamente comprobado."
30326,LECHE CHOCOLATADA NESQUIK X 200 Ml,399,235.0,235.0,40,https://www.hiperlibertad.com.ar/leche-chocolatada-nesquik-x-200-ml/p,LECHE CHOCOLATADA NESQUIK X 200 Ml
28459,GASEOSA VILLA DEL SUR LEVITE FIZZ POMELO X 575 Ml,25,133.64,133.64,112,https://www.hiperlibertad.com.ar/gaseosa-villa-del-sur-levite-fizz-pomelo-x-575-ml/p,GASEOSA VILLA DEL SUR LEVITE FIZZ POMELO X 575 Ml
28949,"GASEOSA VILLA DEL SUR LEVITE FIZZ LIMON X 2,25 Lts",23,360.99,360.99,111,https://www.hiperlibertad.com.ar/gaseosa-villa-del-sur-levite-fizz-limon-x-2-25-lts/p,"GASEOSA VILLA DEL SUR LEVITE FIZZ LIMON X 2,25 Lts"
28458,"GASEOSA VILLA DEL SUR LEVITE FIZZ POMELO X 2,25 Lts",25,360.99,360.99,113,https://www.hiperlibertad.com.ar/gaseosa-villa-del-sur-levite-fizz-pomelo-x-2-25-lts/p,"GASEOSA VILLA DEL SUR LEVITE FIZZ POMELO X 2,25 Lts"
30329,CREMA CORPORAL HINDS ROSA PLUS X 350 Ml,440,865.0,865.0,49,https://www.hiperlibertad.com.ar/crema-corporal-hinds-rosa-plus-x-350-ml/p,CREMA CORPORAL HINDS ROSA PLUS X 350 Ml
29367,MANTECA LA SERENISIMA REDUCIDA EN GRASAS UNTABLE X 200 Gr,535,650.0,650.0,19,https://www.hiperlibertad.com.ar/manteca-la-serenisima-reducida-en-grasas-untable-x-200-gr/p,MANTECA LA SERENISIMA REDUCIDA EN GRASAS UNTABLE X 200 Gr
31371,JABON PROTEX HIDRATACION X 80 Gr,438,188.06,188.06,34,https://www.hiperlibertad.com.ar/jabon-protex-hidratacion-x-80-gr/p,JABON PROTEX HIDRATACION X 80 Gr
29956,JABON PROTEX REGENERACION X 80 Gr,438,182.99,182.99,73,https://www.hiperlibertad.com.ar/jabon-protex-regeneracion-x-80-gr/p,JABON PROTEX REGENERACION X 80 Gr
29818,CREMA DENTAL COLGATE TRIPLE ACCION X 210 Gr,425,799.99,799.99,45,https://www.hiperlibertad.com.ar/crema-dental-colgate-triple-accion-x-210-gr/p,CREMA DENTAL COLGATE TRIPLE ACCION X 210 Gr
31233,CEPILLO DENTAL COLGATE EXTRA CLEAN DURO X 2 U,426,307.99,307.99,193,https://www.hiperlibertad.com.ar/cepillo-dental-colgate-extra-clean-duro-x-2-u/p,CEPILLO DENTAL COLGATE EXTRA CLEAN DURO X 2 U
28462,CREMA DENTAL COLGATE TRIPLE ACCION X 180 Gr,425,760.99,760.99,73,https://www.hiperlibertad.com.ar/crema-dental-colgate-triple-accion-x-180-gr/p,CREMA DENTAL COLGATE TRIPLE ACCION X 180 Gr
33327,JOINVILLE Vaso Cerv.300 ml Gr.,126,799.0,799.0,18,https://www.hiperlibertad.com.ar/joinville-vaso-cerv-300-ml-gr/p,VASO CERVECERO DE VIDRIO TRANSPARENTE  PARA CERVEZA CAPACIDAD 300 ML MEDIDAS 7 CM DE DIAMETRO X 16.5 CM DE ALTURA
35993,BANDEJA FINLANDEK 30X30 CIRCU,168,3799.0,3799.0,6,https://www.hiperlibertad.com.ar/bandeja-finlandek-30x30-circu/p,BANDEJA FINLANDEK 30X30 CIRCU
36026,"BANDEJA FINLANDEK 35X25 ""HOME",168,3299.0,3299.0,10,https://www.hiperlibertad.com.ar/bandeja-finlandek-35x25-home/p,"BANDEJA FINLANDEK 35X25 ""HOME"
36010,CUADRO FINLANDEK 30X30,160,1999.0,1999.0,20,https://www.hiperlibertad.com.ar/cuadro-finlandek-30x30/p,CUADRO FINLANDEK 30X30
36025,PERCHERO P/PARED FINLANDEK 15,168,1499.0,1499.0,2,https://www.hiperlibertad.com.ar/perchero-p-pared-finlandek-15/p,PERCHERO P/PARED FINLANDEK 15
36001,PANTALLA FINLANDEK 25X40 NAT,168,7499.0,7499.0,22,https://www.hiperlibertad.com.ar/pantalla-finlandek-25x40-nat/p,PANTALLA FINLANDEK 25X40 NAT
36000,PANTALLA FINLANDEK 18X30 NAT,168,5999.0,5999.0,23,https://www.hiperlibertad.com.ar/pantalla-finlandek-18x30-nat/p,PANTALLA FINLANDEK 18X30 NAT
35999,CESTA FINLANDEK 30X7 NAT/BCO,168,2699.0,2699.0,43,https://www.hiperlibertad.com.ar/cesta-finlandek-30x7-nat-bco/p,CESTA FINLANDEK 30X7 NAT/BCO
35998,CESTA FINLANDEK 33X8 NAT/BCO,168,2999.0,2999.0,36,https://www.hiperlibertad.com.ar/cesta-finlandek-33x8-nat-bco/p,CESTA FINLANDEK 33X8 NAT/BCO
35992,CANDELABRO FINLANDEK 15X20 AZ,161,2999.0,2999.0,18,https://www.hiperlibertad.com.ar/candelabro-finlandek-15x20-az/p,CANDELABRO FINLANDEK 15X20 AZ
35991,CANDELABRO FINLANDEK 14X16 CE,161,2599.0,2599.0,16,https://www.hiperlibertad.com.ar/candelabro-finlandek-14x16-ce/p,CANDELABRO FINLANDEK 14X16 CE
35990,CANDELABRO FINLANDEK 11X14 BC,161,1999.0,1999.0,28,https://www.hiperlibertad.com.ar/candelabro-finlandek-11x14-bc/p,CANDELABRO FINLANDEK 11X14 BC
36015,"PORTAVELAS FINLANDEK 10X7,5",161,899.0,899.0,16,https://www.hiperlibertad.com.ar/portavelas-finlandek-10x7-5/p,"PORTAVELAS FINLANDEK 10X7,5"
36009,"PORTAVELA FINLANDEK 7,5X5,5",161,699.0,699.0,24,https://www.hiperlibertad.com.ar/portavela-finlandek-7-5x5-5/p,"PORTAVELA FINLANDEK 7,5X5,5"
33306,STOUT Vaso t/l 473ml cerveza,126,529.0,529.0,14,https://www.hiperlibertad.com.ar/stout-vaso-t-l-473ml-cerveza/p,"Vaso Cervecero Capacidad 473 ML.- Realizado en vidrio, de alta transparencia y perfecto acabado"
31232,CREMA CORPORAL HINDS ROSA PLUS X 250 Ml,440,486.74,648.99,28,https://www.hiperlibertad.com.ar/crema-corporal-hinds-rosa-plus-x-250-ml/p,CREMA CORPORAL HINDS ROSA PLUS X 250 Ml
31065,CREMA FACIAL NIVEA Q10 ENERGY ANTIARRUGAS NOCHE X 50 Ml,442,2601.99,2601.99,10,https://www.hiperlibertad.com.ar/crema-facial-nivea-q10-energy-antiarrugas-noche-x-50-ml/p,CREMA FACIAL NIVEA Q10 ENERGY ANTIARRUGAS NOCHE X 50 Ml
30321,CREMA CORPORAL NIVEA REAFIRMANTE Q10 PLUS COLLAGEN X 250 Ml,440,976.0,976.0,13,https://www.hiperlibertad.com.ar/crema-corporal-nivea-reafirmante-q10-plus-collagen-x-250-ml/p,CREMA CORPORAL NIVEA REAFIRMANTE Q10 PLUS COLLAGEN X 250 Ml
29953,MAQUINA DE AFEITAR GILLETTE PRESTOBARBA 2 ULTRAGRIP PLUS X 10 U,552,2025.99,2025.99,12,https://www.hiperlibertad.com.ar/maquina-de-afeitar-gillette-prestobarba-2-ultragrip-plus-x-10-u/p,MAQUINA DE AFEITAR GILLETTE PRESTOBARBA 2 ULTRAGRIP PLUS X 10 U
29952,MAQUINA DE AFEITAR GILLETTE PRESTOBARBA 2 ULTRAGRIP PLUS X 5 U,552,1077.0,1077.0,102,https://www.hiperlibertad.com.ar/maquina-de-afeitar-gillette-prestobarba-2-ultragrip-plus-x-5-u/p,MAQUINA DE AFEITAR GILLETTE PRESTOBARBA 2 ULTRAGRIP PLUS X 5 U
29372,MAQUINA DE AFEITAR GILLETTE PRESTOBARBA 3 SENSITIVE COMFORTGEL X 8 U,552,2097.99,2097.99,10,https://www.hiperlibertad.com.ar/maquina-de-afeitar-gillette-prestobarba-3-sensitive-comfortgel-x-8-u/p,MAQUINA DE AFEITAR GILLETTE PRESTOBARBA 3 SENSITIVE COMFORTGEL X 8 U
29951,MAQUINA DE AFEITAR GILLETTE PRESTOBARBA 3 SENSITIVE COMFORTGEL X 2 U,552,701.99,701.99,159,https://www.hiperlibertad.com.ar/maquina-de-afeitar-gillette-prestobarba-3-sensitive-comfortgel-x-2-u/p,MAQUINA DE AFEITAR GILLETTE PRESTOBARBA 3 SENSITIVE COMFORTGEL X 2 U
29370,MAQUINA DE AFEITAR GILLETTE PRESTOBARBA 3 COMFORTGEL X 4 U,552,1199.0,1199.0,27,https://www.hiperlibertad.com.ar/maquina-de-afeitar-gillette-prestobarba-3-comfortgel-x-4-u/p,MAQUINA DE AFEITAR GILLETTE PRESTOBARBA 3 COMFORTGEL X 4 U
28460,MAQUINA DE AFEITAR GILLETTE PRESTOBARBA 3 COMFORTGEL X 2 U,552,667.99,667.99,116,https://www.hiperlibertad.com.ar/maquina-de-afeitar-gillette-prestobarba-3-comfortgel-x-2-u/p,MAQUINA DE AFEITAR GILLETTE PRESTOBARBA 3 COMFORTGEL X 2 U
29375,ENJUAGUE BUCAL LISTERINE PRO ENCIAS X 500 Ml,427,1193.0,1193.0,16,https://www.hiperlibertad.com.ar/enjuague-bucal-listerine-pro-encias-x-500-ml/p,"LISTERINE® PRO-ENCÍAS Frescura Intensa. 
Fórmula exclusiva con agentes antibacterianos que eliminan hasta el 99,9% de los gérmenes que causan placa, gingivitis y mal aliento en solo 30 segundos. 
La innovadora combinación de los cuatro aceites esenciales de LISTERINE® (Timol, Eucaliptol, Mentol y Salicilato de Metilo) actúa sobre las bacterias escondidas en lo más profundo de la boca.
Con Flúor activo para encías más protegidas en 2 semanas. *.*
Odontológicamente comprobado.
* vs solo cepillado."
36018,CESTA DE FIBRA NATURAL 30X35X30CM,139,6299.0,6299.0,14,https://www.hiperlibertad.com.ar/cesta-de-fibra-natural-30x35x30cm/p,CESTA DE FIBRA NATURAL 30X35X30CM
35007,CESTA BOX DE FIBRA NATURAL  38X15X14CM,139,3149.0,3149.0,11,https://www.hiperlibertad.com.ar/cesta-box-de-fibra-natural-38x15x14cm/p,CESTA BOX DE FIBRA NATURAL  38X15X14CM
35090,CESTA DE FIBRA NATURAL 35X21X17CM,139,4699.0,4699.0,13,https://www.hiperlibertad.com.ar/cesta-de-fibra-natural-35x21x17cm/p,CESTA DE FIBRA NATURAL 35X21X17CM
36005,CESTA DE FIBRA NATURAL 37X30CM,139,5499.0,5499.0,10,https://www.hiperlibertad.com.ar/cesta-de-fibra-natural-37x30cm-2/p,CESTA DE FIBRA NATURAL 37X30CM
36039,CESTA DE FIBRA NATURAL 41X34CM,139,6499.0,6499.0,9,https://www.hiperlibertad.com.ar/cesta-de-fibra-natural-41x34cm-2/p,CESTA DE FIBRA NATURAL 41X34CM
35996,CESTA DE FIBRA NATURAL 46X38CM,139,7299.0,7299.0,9,https://www.hiperlibertad.com.ar/cesta-de-fibra-natural-46x38cm-2/p,CESTA DE FIBRA NATURAL 46X38CM
35987,CESTA DE FIBRA NATURAL 34X26CM,139,5499.0,5499.0,19,https://www.hiperlibertad.com.ar/cesta-de-fibra-natural-34x26cm/p,CESTA DE FIBRA NATURAL 34X26CM
36022,CESTA DE FIBRA NATURAL 45X38CM,139,6599.0,6599.0,17,https://www.hiperlibertad.com.ar/cesta-de-fibra-natural-45x38cm/p,CESTA DE FIBRA NATURAL 45X38CM
35986,CESTA DE FIBRA NATURAL 21X29X12CM,139,1999.0,1999.0,13,https://www.hiperlibertad.com.ar/cesta-de-fibra-natural-21x29x12cm/p,CESTA DE FIBRA NATURAL 21X29X12CM
36004,CESTA DE FIBRA NATURAL 24X32X14CM,139,2799.0,2799.0,17,https://www.hiperlibertad.com.ar/cesta-de-fibra-natural-24x32x14cm/p,CESTA DE FIBRA NATURAL 24X32X14CM
36038,CESTA DE FIBRA NATURAL 30X45X30CM,139,6999.0,6999.0,6,https://www.hiperlibertad.com.ar/cesta-de-fibra-natural-30x45x30cm/p,CESTA DE FIBRA NATURAL 30X45X30CM
35031,CESTA DE FIBRA NATURAL 33X25X14CM,139,3149.0,3149.0,16,https://www.hiperlibertad.com.ar/cesta-de-fibra-natural-33x25x14cm/p,CESTA DE FIBRA NATURAL 33X25X14CM
35089,CESTA DE FIBRA NATURAL 37X30X16CM,139,4549.0,4549.0,21,https://www.hiperlibertad.com.ar/cesta-de-fibra-natural-37x30x16cm/p,CESTA DE FIBRA NATURAL 37X30X16CM
35006,CESTA DE FIBRA NATURAL 40X34X17CM,139,5299.0,5299.0,20,https://www.hiperlibertad.com.ar/cesta-de-fibra-natural-40x34x17cm/p,CESTA DE FIBRA NATURAL 40X34X17CM
35005,CESTA DE FIBRA NATURAL 47X62CM,139,5249.0,5249.0,12,https://www.hiperlibertad.com.ar/cesta-de-fibra-natural-47x62cm/p,CESTA DE FIBRA NATURAL 47X62CM
35032,CESTA DE FIBRA NATURAL 55X37CM,139,6799.0,6799.0,13,https://www.hiperlibertad.com.ar/cesta-de-fibra-natural-55x37cm/p,CESTA DE FIBRA NATURAL 55X37CM
35044,CESTA DE FIBRA NATURAL,139,11999.0,11999.0,13,https://www.hiperlibertad.com.ar/cesta-de-fibra-natural/p,CESTA DE FIBRA NATURAL
35058,CESTA DE FIBRA NATURAL 29X24CM,139,3799.0,3799.0,9,https://www.hiperlibertad.com.ar/cesta-de-fibra-natural-29x24cm/p,CESTA DE FIBRA NATURAL 29X24CM
35030,CESTA DE FIBRA NATURAL 35X28CM,139,4899.0,4899.0,9,https://www.hiperlibertad.com.ar/cesta-de-fibra-natural-35x28cm/p,CESTA DE FIBRA NATURAL 35X28CM
35075,CESTA DE FIBRA NATURAL 42X40CM,139,5799.0,5799.0,9,https://www.hiperlibertad.com.ar/cesta-de-fibra-natural-42x40cm/p,CESTA DE FIBRA NATURAL 42X40CM
35043,CESTA DE FIBRA NATURAL 49X34CM,139,7699.0,7699.0,10,https://www.hiperlibertad.com.ar/cesta-de-fibra-natural-49x34cm/p,CESTA DE FIBRA NATURAL 49X34CM
35015,CESTA DE FIBRA NATURAL 57X38CM,139,9799.0,9799.0,12,https://www.hiperlibertad.com.ar/cesta-de-fibra-natural-57x38cm/p,CESTA DE FIBRA NATURAL 57X38CM
28040,"BOCADITOS DE POLLO LA BLANCA X 1,5 Kg",624,2679.0,2679.0,2,https://www.hiperlibertad.com.ar/bocaditos-de-pollo-la-blanca-x-1-5-kg/p,"BOCADITOS DE POLLO LA BLANCA X 1,5 Kg"
29653,DONUTS BONAFIDE BLANCAS X 52 GR,341,273.99,273.99,135,https://www.hiperlibertad.com.ar/donuts-bonafide-blancas-x-52-gr/p,DONUTS BONAFIDE BLANCAS X 52 GR
30791,CHOCOLATE VIZZIO 60% CACAO X 90 Gr,354,483.99,483.99,267,https://www.hiperlibertad.com.ar/chocolate-vizzio-60-cacao-x-90-gr/p,CHOCOLATE VIZZIO 60% CACAO X 90 Gr
33309,DESTAPADOR Y ABRELATAS AC INO,125,499.0,499.0,11,https://www.hiperlibertad.com.ar/destapador-y-abrelatas-ac-ino/p,Destapador de botellas y abrelatas. Acero inoxidable
33297,CUCHARA PARA COCKTAIL AC INOX,127,769.0,769.0,12,https://www.hiperlibertad.com.ar/cuchara-para-cocktail-ac-inox/p,"Para que prepares tus mejores tragos con la Cuchara para cocktail. Acero inoxidable 30,50 cm"
33316,TABLA POLIPROP 35X22.5 varios colores,125,2399.0,2399.0,46,https://www.hiperlibertad.com.ar/tabla-poliprop-35x22-5-varios-colores/p,"tabla mediana 35 x 22,50 cm. Colores surtidos: Olive, Serenity, Sand y Quartz"
31201,Los más impresionantes dinosaurios del mundo,633,1899.0,1899.0,4,https://www.hiperlibertad.com.ar/los-m-s-impresionantes-dinosaurios-del-mundo/p,Los más impresionantes dinosaurios del mundo.
28920,365 Dinosaurios y otros Animales Prehistóricos,633,4999.0,4999.0,1,https://www.hiperlibertad.com.ar/365-dinosaurios-y-otros-animales-prehist-ricos/p,365 Dinosaurios y otros Animales Prehistóricos
29351,La espía,633,3299.0,3299.0,1,https://www.hiperlibertad.com.ar/la-esp-a/p,Danielle Steel nos transporta desde la Segunda Guerra Mundial  hasta los años de la Guerra Fría en esta historia repleta de emoción y aventura.
29350,La mansión. Tiempo de resurgir,633,4599.0,4599.0,1,https://www.hiperlibertad.com.ar/la-mansi-n-tiempo-de-resurgir/p,"La mansión ha marcado la historia y el futuro de la familia Von  Dranitz. Pero ¿es finalmente el momento de dejar atrás el pasado?  Llega la brillante conclusión de La mansión, la cautivadora  saga familiar que dos millones y medio de lectoras estaban esperando."
28932,CARAMELOS MEDIA HORA X 800 Gr,353,2174.99,2174.99,6,https://www.hiperlibertad.com.ar/caramelos-media-hora-x-800-gr/p,CARAMELOS MEDIA HORA X 800 Gr
33303,Ana de las tejas verdes 1. La llegada,633,1699.0,1699.0,6,https://www.hiperlibertad.com.ar/ana-de-las-tejas-verdes-1-la-llegada/p,"Las peripecias de Ana de las Tejas Verdes, una saga clásica ahora  revisada y actualizada en esta cuidada edición ilustrada por María Llovet.  Uno de los personajes más entrañables de la literatura universal."
28926,CEPILLO DENTAL ORAL-B CLEAN INDICATOR CONTROL-BAC X 3 U,426,465.29,516.99,10,https://www.hiperlibertad.com.ar/cepillo-dental-oral-b-clean-indicator-control-bac-x-3-u/p,CEPILLO DENTAL ORAL-B CLEAN INDICATOR CONTROL-BAC X 3 U
31045,AM E COL 8.1 RUBIO CLARO CENI,419,439.99,439.99,7,https://www.hiperlibertad.com.ar/tintura-para-cabello-kit-alta-moda-8-1-rubio-claro-ceniza-x-60-ml/p,AM E COL 8.1 RUBIO CLARO CENI
29356,TINTURA PARA CABELLO KIT ALTA MODA 6.7 RUBIO OSCURO CHOCOLATE X 60 Ml,419,439.99,439.99,12,https://www.hiperlibertad.com.ar/tintura-para-cabello-kit-alta-moda-6-7-rubio-oscuro-chocolate-x-60-ml/p,TINTURA PARA CABELLO KIT ALTA MODA 6.7 RUBIO OSCURO CHOCOLATE X 60 Ml
29800,SABORIZADOR ESPECIAS KNORR MIX ORIENTAL X 35 Gr,383,186.99,186.99,25,https://www.hiperlibertad.com.ar/saborizador-especias-knorr-mix-oriental-x-35-gr/p,SABORIZADOR ESPECIAS KNORR MIX ORIENTAL X 35 Gr
30302,TINTURA PARA CABELLO KIT ALTA MODA 3 CASTAÑO OSCURO X 60 Ml,419,439.99,439.99,12,https://www.hiperlibertad.com.ar/tintura-para-cabello-kit-alta-moda-3-casta-o-oscuro-x-60-ml/p,TINTURA PARA CABELLO KIT ALTA MODA 3 CASTAÑO OSCURO X 60 Ml
33269,COMPOTERA YESI SUNDAE PLASTICO,126,179.0,179.0,91,https://www.hiperlibertad.com.ar/compotera-yesi-sundae-plastico/p,COMPOTERA YESI SUNDAE PLASTICO
28929,GALLETAS CORMILLOT AVENA CON ALMENDRAS Y CHIPS DE CHOCOLATE X 160 Gr,341,174.99,174.99,1,https://www.hiperlibertad.com.ar/galletas-cormillot-avena-con-almendras-y-chips-de-chocolate-x-160-gr/p,GALLETAS CORMILLOT AVENA CON ALMENDRAS Y CHIPS DE CHOCOLATE X 160 Gr
28442,GALLETAS CORMILLOT AVENA Y PASAS DE UVA X 160 Gr,341,174.99,174.99,6,https://www.hiperlibertad.com.ar/galletas-cormillot-avena-y-pasas-de-uva-x-160-gr/p,GALLETAS CORMILLOT AVENA Y PASAS DE UVA X 160 Gr
31205,GALLETAS CORMILLOT AVENA CON MIX DE SEMILLAS X 160 Gr,341,174.99,174.99,4,https://www.hiperlibertad.com.ar/galletas-cormillot-avena-con-mix-de-semillas-x-160-gr/p,GALLETAS CORMILLOT AVENA CON MIX DE SEMILLAS X 160 Gr
31046,SCONS CORMILLOT CON CHIPS X 250 Gr,341,174.99,174.99,32,https://www.hiperlibertad.com.ar/scons-cormillot-con-chips-x-250-gr/p,SCONS CORMILLOT CON CHIPS X 250 Gr
31047,MIX DE HIERBAS Y ESPECIAS KNORR AHUMADO X 20 Gr,383,176.5,176.5,27,https://www.hiperlibertad.com.ar/mix-de-hierbas-y-especias-knorr-ahumado-x-20-gr/p,MIX DE HIERBAS Y ESPECIAS KNORR AHUMADO X 20 Gr
