sku,producto,categoria,precio,precio_lista,stock,url,descripcion
33514,FUENTE OVAL LE CUISINE 4 l,132,9199.0,9199.0,9,https://www.hiperlibertad.com.ar/fuente-oval-le-cuisine-4-l/p,"FUENTE OVAL OVENWARE 39x27x6 cm , 4 l. Material : Vidrio Templado Borosilicato"
33547,FUENTE OVAL LE CUISINE 2 l,132,4899.0,4899.0,4,https://www.hiperlibertad.com.ar/fuente-oval-le-cuisine-2-l/p,"FUENTE OVAL OVENWARE 30x21x6 cm , 2 l. Material : Vidrio Templado Borosilicato"
33602,CACEROLA OVAL LE CUISINE OVENWARE 33x20x13 cm - 4 l,123,9999.0,9999.0,4,https://www.hiperlibertad.com.ar/cacerola-oval-le-cuisine-ovenware-33x20x13-cm-4-l/p,Cacerola Oval Le Cuisine Ovenware 4l. Material : vidrio.
33544,CACEROLA REDONDA LE CUISINE 3 l,123,8299.0,8299.0,6,https://www.hiperlibertad.com.ar/cacerola-redonda-le-cuisine-3-l/p,"CACEROLA REDONDA LE CUISINE OVENWARE 27x23x11 cm , 3 l. Material : Vidrio Templado Borosilicato"
33513,"CACEROLA REDONDA LE CUISINE 2,1 l",123,6599.0,6599.0,2,https://www.hiperlibertad.com.ar/cacerola-redonda-le-cuisine-2-1-l/p,"CACEROLA REDONDA LE CUISINE OVENWARE 24x20x10 cm , 2,1 l.Material : Vidrio Templado Borosilicato"
33631,JARRO HERVIDOR  ALUMINIO 14CM  HUDSON- APTO INDUCCIÓN,123,5999.0,5999.0,13,https://www.hiperlibertad.com.ar/jarro-hervidor-aluminio-14cm-hudson-apto-inducci-n/p,Jarro Hervidor  Hudson Induccion 14 Cm. Material: Aluminio 2.2 mm espesor.
33610,BIFERA  ALUMINIO FORJADO HUDSON 26X26 CM - APTO INDUCCIÓN,124,10299.0,10299.0,5,https://www.hiperlibertad.com.ar/bifera-aluminio-forjado-hudson-26x26-cm-apto-inducci-n/p,Bifera Con Antiadherente Ceramica Hudson - 26 Cm - Apto Induccion.Material: Aluminio 4mm espesor.
33848,Ensaladera Bowl De Vidrio Hudson 23 X 11 Cm,131,3299.0,3299.0,2,https://www.hiperlibertad.com.ar/ensaladera-bowl-de-vidrio-hudson-23-x-11-cm/p,"Ensaladera Bowl De Vidrio Hudson 23 X 11 Cm, 2 l .Material: Vidrio templado."
33531,FUENTE DE VIDRIO OVALADA 393x276.5x65mm,132,3999.0,3999.0,3,https://www.hiperlibertad.com.ar/fuente-de-vidrio-ovalada-393x276-5x65mm/p,Asaderas Vidrio Templado Hudson Ovalada Horno 39x27x6cm
33584,PIZZERA COBRE HUDSON ANTIADHERENTE 35 CM,132,4299.0,4299.0,88,https://www.hiperlibertad.com.ar/pizzera-cobre-hudson-antiadherente-35-cm/p,"PIZZERA COBRE HUDSON CON DOBLE CAPA ANTIADHERENTE 35 CM. Material: Acero Carbono con doble capa Antiadherente Cerámica . Apto para cocinas a gas, eléctricas y vitrocerámica."
33647,ASADERA RECTANGULAR HUDSON 37.5 X 22.5 X 0.4 CM,132,4999.0,4999.0,23,https://www.hiperlibertad.com.ar/asadera-rectangular-hudson-37-5-x-22-5-x-0-4-cm/p,"ASADERA RECTANGULAR cobre  HUDSON C/DOBLE CAPA ANTIADHERENTE  37.5 X 22.5 X 0.4 CM. Material: Acero Carbono con doble capa Antiadherente Cerámica . Apto para cocinas a gas, eléctricas y vitrocerámica."
33530,MOLDE TARTERA HUDSON C/DOBLE CAPA ANTIADHERENTE 25 CM,132,2999.0,2999.0,54,https://www.hiperlibertad.com.ar/molde-tartera-hudson-c-doble-capa-antiadherente-25-cm/p,"Molde Tartera  cobre Hudson 1 Pieza Doble Antiadherente 25 Cm.Material: Acero Carbono con doble capa Antiadherente Cerámica . Apto para cocinas a gas, eléctricas y vitrocerámica."
33516,MOLDE MUFFINS X 12 CUPCAKES C/DOBLE CAPA ANTIADHERENTE HUDSON,132,6799.0,6799.0,12,https://www.hiperlibertad.com.ar/molde-muffins-x-12-cupcakes-c-doble-capa-antiadherente-hudson/p,"MOLDE MUFFINS COBRE HUDSON  X 12 CUPCAKES C/DOBLE CAPA ANTIADHERENTE. Material: Acero Carbono con doble capa Antiadherente Cerámica . Apto para cocinas a gas, eléctricas y vitrocerámica."
33646,"MOLDE FLAN , BUDIN SAVARIN C/DOBLE CAPA ANTIADHERENTE  HUDSON 25cm",132,4499.0,4499.0,22,https://www.hiperlibertad.com.ar/molde-flan-budin-savarin-c-doble-capa-antiadherente-hudson-25cm/p,"MOLDE FLAN , BUDIN SAVARIN cobre HUDSON C/DOBLE CAPA ANTIADHERENTE 25 X 26.5 X 7,5 CM.  Material: Acero Carbono con doble capa Antiadherente Cerámica . Apto para cocinas a gas, eléctricas y vitrocerámica."
33589,BOWL 15 CMS AMARILLO,126,1669.0,1669.0,12,https://www.hiperlibertad.com.ar/bowl-15-cms-amarillo/p,Bowl con filo envejecido rustico con color irregular de CERAMICA de color amarillo.- 15cm de diametro
33680,TOALLON JACQUARD DANUBIO 70CMX140CM 500G AVELLANA,135,3749.25,4999.0,4,https://www.hiperlibertad.com.ar/toallon-jacquard-danubio-70cmx140cm-500g-avellana/p,"TOALLON JACQUARD DANUBIO 70CMX140CM 500G AVELLANA. 100% de algodón que nos brinda una excelente absorión y durabilidad. Nos otorga la frescura del algodón y el diseño, que solo una marca como Danubio puede brindar"
33684,TOALLON JACQUARD DANUBIO 70CMX140CM 500G WHITE,135,3749.25,4999.0,6,https://www.hiperlibertad.com.ar/toallon-jacquard-danubio-70cmx140cm-500g-white/p,"TOALLON JACQUARD DANUBIO 70CMX140CM 500G WHITE. 100% de algodón que nos brinda una excelente absorión y durabilidad. Nos otorga la frescura del algodón y el diseño, que solo una marca como Danubio puede brindar"
33690,TOALLA JACQUARD DANUBIO 50CMX80CM 500G AVELLANA,135,1799.25,2399.0,19,https://www.hiperlibertad.com.ar/toalla-jacquard-danubio-50cmx80cm-500g-avellana/p,"TOALLA JACQUARD DANUBIO 50CMX80CM 500G AVELLANA. 100% de algodón que nos brinda una excelente absorión y durabilidad. Nos otorga la frescura del algodón y el diseño, que solo una marca como Danubio puede brindar"
33689,TOALLA JACQUARD DANUBIO 50CMX80CM 500G  GRAPE,135,1799.25,2399.0,16,https://www.hiperlibertad.com.ar/toalla-jacquard-danubio-50cmx80cm-500g-grape/p,"TOALLA JACQUARD DANUBIO 50CMX80CM 500G  GRAPE. 100% de algodón que nos brinda una excelente absorión y durabilidad. Nos otorga la frescura del algodón y el diseño, que solo una marca como Danubio puede brindar"
33676,TOALLA JACQUARD DANUBIO 50CMX80CM 500G  WHITE,135,1799.25,2399.0,14,https://www.hiperlibertad.com.ar/toalla-jacquard-danubio-50cmx80cm-500g-white/p,"TOALLA JACQUARD DANUBIO 50CMX80CM 500G  WHITE.100% de algodón que nos brinda una excelente absorión y durabilidad. Nos otorga la frescura del algodón y el diseño, que solo una marca como Danubio puede brindar"
33691,TOALLA JACQUARD DANUBIO 50CMX80CM 500G VERDE,135,1799.25,2399.0,7,https://www.hiperlibertad.com.ar/toalla-jacquard-danubio-50cmx80cm-500g-verde/p,"TOALLA JACQUARD DANUBIO 50CMX80CM 500G VERDE. 100% de algodón que nos brinda una excelente absorión y durabilidad. Nos otorga la frescura del algodón y el diseño, que solo una marca como Danubio puede brindar"
33838,CALEFACTOR PEABODY TIRO BALANCEADO 4000 Kcal,73,26899.0,26899.0,4,https://www.hiperlibertad.com.ar/calefactor-peabody-tiro-balanceado-4000-kcal/p,"<p>- Calefactor a gas tiro balanceado Peabody 4000 Kcal/h<br />- Tiro BalanceadoVálvula de seguridad<br />- Capacidad: 4000 KCAL.<br />- Superficie calefaccionada: 45 M3.<br />- Color: Gris visón.<br />- Encendido piezoelectrico, visor, regulador de presión a gas.<br />- Dimensiones son: 85 cm x 50 cm x 21 cm"
33294,PAPAS FRITAS LAYS CEBOLLA CARAMELIZADA X 85 Gr,390,433.99,433.99,269,https://www.hiperlibertad.com.ar/papas-fritas-lays-cebolla-caramelizada-x-85-gr/p,PAPAS FRITAS LAYS CEBOLLA CARAMELIZADA X 85 Gr
33295,PAPAS FRITAS LAYS PIMIENTA Y QUESO X 85 Gr,390,433.99,433.99,7,https://www.hiperlibertad.com.ar/papas-fritas-lays-pimienta-y-queso-x-85-gr/p,PAPAS FRITAS LAYS PIMIENTA Y QUESO X 85 Gr
33718,"JUEGO SABANAS TALLERES 1,5 plaza",148,10990.0,10990.0,3,https://www.hiperlibertad.com.ar/juego-sabanas-talleres-1-5-plaza/p,"JUEGO SABANAS TALLERES 1,5 plaza, 100% poliester.Vestí tu cama de tu pasión!"
33714,"JUEGO SABANAS BELGRANO 1,5 Plaza",148,10990.0,10990.0,5,https://www.hiperlibertad.com.ar/juego-sabanas-belgrano-1-5-plaza/p,"JUEGO SABANAS BELGRANO 1,5 plaza, 100% poliester.Vestí tu cama de tu pasión!"
34667,FLORERO 20 CMS,163,1899.0,1899.0,48,https://www.hiperlibertad.com.ar/florero-20-cms/p,FLORERO 20 CMS
34664,BOWL 14 CM BCO PORC,126,1469.0,1469.0,25,https://www.hiperlibertad.com.ar/bowl-porcelana-blanca/p,BOWL 14 CM BCO PORC
34662,PLATO HONDO 22CM BCO PORC,122,1489.0,1489.0,19,https://www.hiperlibertad.com.ar/plato-hondo-22-cms/p,PLATO HONDO 22CM BCO PORC
34663,PLATO POSTRE 20 CM BCO PORC,122,1249.0,1249.0,27,https://www.hiperlibertad.com.ar/plato-postre-20-cms/p,PLATO POSTRE 20 CM BCO PORC
34661,PLATO PLAYO 26CM BCO PORC,122,1569.0,1569.0,19,https://www.hiperlibertad.com.ar/plato-playo-26-cms/p,PLATO PLAYO 26CM BCO PORC
33511,PLATO POSTRE 20 CMS AMARILLO,122,1669.0,1669.0,18,https://www.hiperlibertad.com.ar/plato-postre-20-cms-amarillo/p,Plato postre con filo envejecido rustico con color irregular de CERAMICA de color amarillo.- 20cm de diametro
33651,PLATO POSTRE 20 CMS GRIS,122,1669.0,1669.0,14,https://www.hiperlibertad.com.ar/plato-postre-20-cms-gris/p,Plato postre con filo envejecido rustico con color irregular de CERAMICA de color gris.- 20cm de diametro
33179,Botella CIRCUIT negra,130,2199.0,2199.0,1,https://www.hiperlibertad.com.ar/botella-circuit-negra/p,"Sport Bottle reutilizable de aluminio con tapa rosca de PP y silicona. Cuenta con una tapa con agarre para facilitar su transporte. Producto libre de BPA. Producto aprobado por el I.N.A.L. para el contacto con alimentos. Medidas: 24,5 cm x Ø 7,2 cm. Capacidad: 750 ml."
33186,Botella CIRCUIT blanca,130,2199.0,2199.0,31,https://www.hiperlibertad.com.ar/botella-circuit-blanca/p,"Sport Bottle reutilizable de aluminio con tapa rosca de PP y silicona. Cuenta con una tapa con agarre para facilitar su transporte. Producto libre de BPA. Producto aprobado por el I.N.A.L. para el contacto con alimentos. Medidas: 24,5 cm x Ø 7,2 cm. Capacidad: 750 ml."
33156,Botella RING azul,130,1649.25,2199.0,1,https://www.hiperlibertad.com.ar/botella-ring-azul/p,"Sport Bottle reutilizable de aluminio con tapa rosca de PP, y anillo circular de agarre. Producto libre de BPA. Producto aprobado por el I.N.A.L. para el contacto con alimentos. Medidas: 23 cm x Ø 6,6 cm. Capacidad: 660 ml."
33176,Botella RING gris plata,130,1649.25,2199.0,3,https://www.hiperlibertad.com.ar/botella-ring-gris-plata/p,"Sport Bottle reutilizable de aluminio con tapa rosca de PP, y anillo circular de agarre. Producto libre de BPA. Producto aprobado por el I.N.A.L. para el contacto con alimentos. Medidas: 23 cm x Ø 6,6 cm. Capacidad: 660 ml."
33155,Botella RING negra,130,1649.25,2199.0,2,https://www.hiperlibertad.com.ar/botella-ring-negra/p,"Sport Bottle reutilizable de aluminio con tapa rosca de PP, y anillo circular de agarre. Producto libre de BPA. Producto aprobado por el I.N.A.L. para el contacto con alimentos. Medidas: 23 cm x Ø 6,6 cm. Capacidad: 660 ml."
33175,Botella RING roja,130,1649.25,2199.0,5,https://www.hiperlibertad.com.ar/botella-ring-roja/p,"Sport Bottle reutilizable de aluminio con tapa rosca de PP, y anillo circular de agarre. Producto libre de BPA. Producto aprobado por el I.N.A.L. para el contacto con alimentos. Medidas: 23 cm x Ø 6,6 cm. Capacidad: 660 ml."
33192,Botella Cake lila 600 ml,130,974.25,1299.0,20,https://www.hiperlibertad.com.ar/botella-cake-lila-600-ml/p,"Botella reutilizable de PET con tapa de Polipropileno, cuenta con un agarre en la tapa para su transporte. Producto aprobado por el I.N.A.L. para el contacto con alimentos. Producto libre de BPA. No es apta para bebidas calientes, lavavajillas ni microondas. Medida: 18.5 cm x Ø 6.5 cm. Capacidad: 600m"
33171,Botella Cake verde 600 ml,130,974.25,1299.0,24,https://www.hiperlibertad.com.ar/botella-cake-verde-600-ml/p,"Botella reutilizable de PET con tapa de Polipropileno, cuenta con un agarre en la tapa para su transporte. Producto aprobado por el I.N.A.L. para el contacto con alimentos. Producto libre de BPA. No es apta para bebidas calientes, lavavajillas ni microondas. Medida: 18.5 cm x Ø 6.5 cm. Capacidad: 600m"
33167,Jarro Slice plateado Slazenger 400 ml,130,4274.25,5699.0,17,https://www.hiperlibertad.com.ar/jarro-slice-plateado-slazenger-400-ml/p,"Jarro térmico Slice realizado en acero inoxidable y con tapa cristal clear. Producto aprobado por el I.N.A.L. para el contacto con alimentos. Medidas 7,06 x 9,2 x 15,19 cm. Capacidad: 400 ml. Slazenger."
33166,Jarro Daten Wagner 500 ml,130,4499.25,5999.0,16,https://www.hiperlibertad.com.ar/jarro-daten-wagner-500-ml/p,"Jarro térmico de doble pared en acero inoxidable. Cuenta con terminación exterior en color negro mate. Posee grip de silicona antideslizamiento y Cierre hermético y boca para tomar con traba a presión y silicona para evitar derrames. Producto aprobado por el I.N.A.L. para el contacto con alimentos. Capacidad: 500 ml. Medida: 20,3 x ø 8,2 cm. Producto libre de BPA"
33183,Mate Origen Pampero negro,130,13999.0,13999.0,9,https://www.hiperlibertad.com.ar/mate-origen-pampero-negro/p,"Mate realizado en acero inoxidable bicapa 304 (18/8). Cuenta con doble pared aislante que mantiene la temperatura durante toda la cebada, manteniendo 30 minutos el agua caliente y 3 horas el agua fría. No traspasa sabores ni aromas a tu yerba. Producto libre de BPA, aprobado por el INAL. Incluye bombilla de acero inoxidable. Medidas: Altura: 10.5 cm; Diámetro: 8 cm; Capacidad: 256 ml.  Colores disponibles: Verde y Negro.Pampero."
33162,Mate Origen Pampero verde,130,13999.0,13999.0,12,https://www.hiperlibertad.com.ar/mate-origen-pampero-verde/p,"Mate realizado en acero inoxidable bicapa 304 (18/8). Cuenta con doble pared aislante que mantiene la temperatura durante toda la cebada, manteniendo 30 minutos el agua caliente y 3 horas el agua fría. No traspasa sabores ni aromas a tu yerba. Producto libre de BPA, aprobado por el INAL. Incluye bombilla de acero inoxidable. Medidas: Altura: 10.5 cm; Diámetro: 8 cm; Capacidad: 256 ml.  Colores disponibles: Verde y Negro.Pampero."
33159,Termo Ivy Verde 1 litro,130,29999.0,29999.0,7,https://www.hiperlibertad.com.ar/termo-ivy-verde-1-litro/p,"Termo de acero inoxidable 304, recubierto con esmalte especial que protege de ralladuras y golpes. Cuenta con manija plegable para facilitar el transporte y tapa con superficie plana estable para usar como taza o vaso Medidas: 29 x Ø 9 cm. Mantiene el agua caliente por 12 horas. Cuenta con pico POP UP con push. Capacidad: 1 Litro. Producto libre de BPA."
33180,Termo Ivy Azul 1 litro,130,29999.0,29999.0,7,https://www.hiperlibertad.com.ar/termo-ivy-azul-1-litro/p,"Termo de acero inoxidable 304, recubierto con esmalte especial que protege de ralladuras y golpes. Cuenta con manija plegable para facilitar el transporte y tapa con superficie plana estable para usar como taza o vaso Medidas: 29 x Ø 9 cm. Mantiene el agua caliente por 12 horas. Cuenta con pico POP UP con push. Capacidad: 1 Litro. Producto libre de BPA."
34669,DIP 10CM PASABAHCE,126,1199.0,1199.0,57,https://www.hiperlibertad.com.ar/dip-10cm-pasabahce/p,DIP 10CM PASABAHCE
36845,CAPSULAS DE CAFÉ LA MORENITA ITALIANO X 10 U,339,1174.0,1174.0,13,https://www.hiperlibertad.com.ar/capsulas-de-caf-la-morenita-italiano-x-10-u/p,CAPSULAS DE CAFÉ LA MORENITA ITALIANO X 10 U
33394,Locos x el Asado a fuego fuerte,633,899.0,899.0,2,https://www.hiperlibertad.com.ar/locos-x-el-asado-a-fuego-fuerte/p,El nuevo libro de Locos X el Asado con muchas recetas inéditas al calor del fuego para disfrutar y compartir con la familia y amigos.
33374,Ana de las tejas verdes 3 - La maestra de Avonlea,633,1699.0,1699.0,1,https://www.hiperlibertad.com.ar/ana-de-las-tejas-verdes-3-la-maestra-de-avonlea/p,"Las peripecias de Ana de las Tejas Verdes, una saga clásica ahora revisada y actualizada en esta cuidada edición ilustrada.
Uno de los personajes más entrañables de la literatura universal. El tiempo pasa en Avonlea y Ana Shirley afronta ilusionada una nueva etapa como maestra en la misma escuela donde estudió. Decididaa mejorar la vida del pequeño pueblo, la soñadora pelirroja protagonizará nuevos encuentros y más de un enredo, pero ¿quién se resiste a su simpatía y entusiasmo?"
33475,Pixar valija para jugar,633,499.9,499.9,1,https://www.hiperlibertad.com.ar/pixar-valija-para-jugar/p,Diviértete junto a tus personajes favoritos con esta valija.
33372,Locos x el Asado a fuego medio y lento,633,899.0,899.0,1,https://www.hiperlibertad.com.ar/locos-x-el-asado-a-fuego-medio-y-lento/p,El nuevo libro de Locos X el Asado con muchas recetas inéditas al calor del fuego para disfrutar y compartir con la familia y amigos.
33393,Códigos y computadoras,633,1999.0,1999.0,4,https://www.hiperlibertad.com.ar/c-digos-y-computadoras/p,"Este libro es infinitamente fascinante. Cuenta la verdad sobre la revolución de la tecnología que ha transformado a la cultura. Es un viaje por el detrás de escena y las historias de los pioneros que inventaron las computadoras y otras máquinas increíbles que hoy utilizamos. Repleto de datos reveladores, este libro conectará a los niños con el pasado y el futuro de la tecnología."
33425,"Muchos cuerpos, una misma alma",633,3049.0,3049.0,2,https://www.hiperlibertad.com.ar/muchos-cuerpos-una-misma-alma/p,"El primer libro de Brian Weiss, famoso por descubrir la terapia de regresión a vidas pasadas, es ya un clásico del que se han vendido más de 200.000 ejemplares en España. El psiquiatra Brian Weiss cobró notoriedad internacional con su investigación sobre el poder curativo de la regresión a vidas anteriores, relatada en su célebre obra Muchas vidas, muchos maestros.

En este libro, el autor nos muestra que lo que hagamos en esta vida influirá sobre nuestras reencarnaciones a lo largo del camino de evolución hacia la inmortalidad.

Ésta es una obra revolucionaria, que ahonda en los descubrimientos del doctor Weiss sobre el pasado para transportar a sus millones de lectores hasta un futuro individual y colectivo de cuya creación son responsables ellos mismos. Por el camino, sus vidas quedarán transformadas profundamente y encontrarán más paz, más felicidad y soluciones a sus problemas."
33334,BOWL CHICO - 450ML  SET CON 4 PIEZAS ROJO,126,1379.0,1379.0,3,https://www.hiperlibertad.com.ar/bowl-chico-450ml-set-con-4-piezas-rojo/p,"SET X 4 BOWLS CHICO CAPACIDAD 450ML, COLOR ROJO, PLASTICO PREMIUM"
33296,"BOWL GRANDE - 1,1L   SET CON 4 PIEZAS - ROJO",126,2169.0,2169.0,29,https://www.hiperlibertad.com.ar/bowl-grande-1-1l-set-con-4-piezas-rojo/p,"SET X 4 BOWLS GRANDE CAPACIDAD 1,1LTS, COLOR ROJO, PLASTICO PREMIUM"
33473,Dinosaurios Diverlibros 4,633,559.9,559.9,18,https://www.hiperlibertad.com.ar/dinosaurios-diverlibros-4/p,Una colección con breves historias para leer y colorear. Un sinfín de actividades que invitan a aprender jugando.
33367,Unicornios Diverlibros 4,633,559.9,559.9,13,https://www.hiperlibertad.com.ar/unicornios-diverlibros-4/p,Una colección con breves historias para leer y colorear. Un sinfín de actividades que invitan a aprender jugando.
39362,POTE MASA MAPED CREATIV ROSA X 114 Gr,223,569.0,569.0,24,https://www.hiperlibertad.com.ar/pote-masa-maped-creativ-rosa-x-114-gr/p,POTE MASA MAPED CREATIV ROSA X 114 Gr
33761,CAFE INSTANTANEO NESCAFE DOLCA CORTADO X 125 Gr,339,578.99,578.99,35,https://www.hiperlibertad.com.ar/cafe-instantaneo-nescafe-dolca-cortado-x-125-gr/p,CAFE INSTANTANEO NESCAFE DOLCA CORTADO X 125 Gr
33730,CAFE INSTANTANEO NESCAFE DOLCA CAPUCCINO LIGHT X 125 Gr,339,723.0,723.0,12,https://www.hiperlibertad.com.ar/cafe-instantaneo-nescafe-dolca-capuccino-light-x-125-gr/p,CAFE INSTANTANEO NESCAFE DOLCA CAPUCCINO LIGHT X 125 Gr
34495,CEREAL INFANTIL NESTUM MULTICEREAL X 225 Gr,328,856.99,856.99,4,https://www.hiperlibertad.com.ar/cereal-infantil-nestum-multicereal-x-225-gr/p,CEREAL INFANTIL NESTUM MULTICEREAL X 225 Gr
34288,ACONDICIONADOR DOVE RITUAL DE REPARACION COCO X 200 Ml,420,537.97,537.97,60,https://www.hiperlibertad.com.ar/acondicionador-dove-ritual-de-reparacion-coco-x-200-ml-2/p,ACONDICIONADOR DOVE RITUAL DE REPARACION COCO X 200 Ml
33904,TAL REXONA EFFICIEN ORI X200G,435,555.0,555.0,103,https://www.hiperlibertad.com.ar/desodorante-rexona-efficient-original-en-talco-x-200-gr/p,TAL REXONA EFFICIEN ORI X200G
37272,DESODORANTE PARA PIES REXONA EFFICIENT ORIGINAL AEROSOL X 153 Ml,432,587.0,587.0,3,https://www.hiperlibertad.com.ar/desodorante-para-pies-rexona-efficient-original-aerosol-x-153-ml/p,DESODORANTE PARA PIES REXONA EFFICIENT ORIGINAL AEROSOL X 153 Ml
37375,DESODORANTE PARA PIES REXONA EFFICIENT FRESH AEROSOL X 153 Ml,432,587.0,587.0,8,https://www.hiperlibertad.com.ar/desodorante-para-pies-rexona-efficient-fresh-aerosol-x-153-ml/p,DESODORANTE PARA PIES REXONA EFFICIENT FRESH AEROSOL X 153 Ml
33723,DESODORANTE ANTITRANSPIRANTE EN AEROSOL DOVE MEN CARE INVISIBLE DRY X 150 Ml,432,584.0,584.0,143,https://www.hiperlibertad.com.ar/desodorante-antitranspirante-en-aerosol-dove-men-care-invisible-dry-x-150-ml/p,DESODORANTE ANTITRANSPIRANTE EN AEROSOL DOVE MEN CARE INVISIBLE DRY X 150 Ml
33734,DESODORANTE ANTITRANSPIRANTE EN AEROSOL DOVE MEN CARE EXTRA FRESH X 150 Ml,432,584.0,584.0,4,https://www.hiperlibertad.com.ar/desodorante-antitranspirante-en-aerosol-dove-men-care-extra-fresh-x-150-ml/p,DESODORANTE ANTITRANSPIRANTE EN AEROSOL DOVE MEN CARE EXTRA FRESH X 150 Ml
34289,CEREAL INFANTIL NESTUM BANANA X 225 Gr,328,856.99,856.99,15,https://www.hiperlibertad.com.ar/cereal-infantil-nestum-banana-x-225-gr/p,CEREAL INFANTIL NESTUM BANANA X 225 Gr
33739,CEREALES TRIX X 230 Gr,340,757.0,757.0,17,https://www.hiperlibertad.com.ar/cereales-trix-x-230-gr/p,CEREALES TRIX X 230 Gr
34081,ACONDICIONADOR DOVE RITUAL DE REPARACION COCO Y CURCUMA X 750 Ml,420,1409.12,1409.12,29,https://www.hiperlibertad.com.ar/acondicionador-dove-ritual-de-reparacion-coco-y-curcuma-x-750-ml/p,ACONDICIONADOR DOVE RITUAL DE REPARACION COCO Y CURCUMA X 750 Ml
34080,ACONDICIONADOR DOVE RECONSTRUCCION COMPLETA SUPERIOR X 750 Ml,420,899.0,899.0,6,https://www.hiperlibertad.com.ar/acondicionador-dove-reconstruccion-completa-superior-x-750-ml/p,ACONDICIONADOR DOVE RECONSTRUCCION COMPLETA SUPERIOR X 750 Ml
34079,ACONDICIONADOR DOVE REGENERACION EXTREMA SUPERIOR X 750 Ml,420,899.0,899.0,11,https://www.hiperlibertad.com.ar/acondicionador-dove-regeneracion-extrema-superior-x-750-ml/p,ACONDICIONADOR DOVE REGENERACION EXTREMA SUPERIOR X 750 Ml
34078,ACONDICIONADOR DOVE OLEO NUTRICION SUPERIOR X 750 Ml,420,899.0,899.0,12,https://www.hiperlibertad.com.ar/acondicionador-dove-oleo-nutricion-superior-x-750-ml/p,ACONDICIONADOR DOVE OLEO NUTRICION SUPERIOR X 750 Ml
33749,SH DOVE SP ACT+FR 3EN1 X400ML,421,820.01,820.01,11,https://www.hiperlibertad.com.ar/sh-dove-sp-act-fr-3en1-x400ml/p,SH DOVE SP ACT+FR 3EN1 X400ML
33780,SH DOVE RIT CRE EQUINO X400ML,421,871.99,871.99,21,https://www.hiperlibertad.com.ar/sh-dove-rit-cre-equino-x400ml/p,SH DOVE RIT CRE EQUINO X400ML
33725,SH DOVE RIT FORT PALTA X400ML,421,871.99,871.99,117,https://www.hiperlibertad.com.ar/sh-dove-rit-fort-palta-x400ml/p,SH DOVE RIT FORT PALTA X400ML
33741,SH DOVE RITU REPA COCO X400ML,421,871.99,871.99,57,https://www.hiperlibertad.com.ar/sh-dove-ritu-repa-coco-x400ml/p,SH DOVE RITU REPA COCO X400ML
33764,SH DOVE REC COMP SUPE X400ML,421,871.99,871.99,33,https://www.hiperlibertad.com.ar/sh-dove-rec-comp-supe-x400ml/p,SH DOVE REC COMP SUPE X400ML
33772,AC DOVE RIT CRE EQUINO X400ML,420,871.99,871.99,17,https://www.hiperlibertad.com.ar/ac-dove-rit-cre-equino-x400ml/p,AC DOVE RIT CRE EQUINO X400ML
34320,ACONDICIONADOR DOVE OLEO NUTRICION X 200 Ml,420,349.0,349.0,15,https://www.hiperlibertad.com.ar/acondicionador-dove-oleo-nutricion-x-200-ml-2/p,ACONDICIONADOR DOVE OLEO NUTRICION X 200 Ml
33917,AC DOVE REGEN EXT SUPE X200ML,420,349.0,349.0,16,https://www.hiperlibertad.com.ar/acondicionador-dove-regeneraci-n-extrema-superior-x-200-ml/p,AC DOVE REGEN EXT SUPE X200ML
33778,AC DOVE OLEO NUTR SUPE X400ML,420,871.99,871.99,72,https://www.hiperlibertad.com.ar/ac-dove-oleo-nutr-supe-x400ml/p,AC DOVE OLEO NUTR SUPE X400ML
33763,ACONDICIONADOR DOVE RECONSTRUCCION COMPLETA X 400 Ml,420,871.99,871.99,10,https://www.hiperlibertad.com.ar/acondicionador-dove-reconstruccion-completa-x-400-ml/p,ACONDICIONADOR DOVE RECONSTRUCCION COMPLETA X 400 Ml
33849,PAÑALES PAMPERS PREMIUM CARE PANTS HIPOALERGÉNICO TALLE G X 30 U,229,3738.99,3738.99,2,https://www.hiperlibertad.com.ar/pa-ales-pampers-premium-care-pants-hipoalerg-nico-talle-g-x-30-u/p,"¡Probá los nuevos Pampers Premium Care Pants Hipoalergénicos! Con su cintura elástica 360 son fáciles de poner, incluso cuando tu bebé está en movimiento, dándole un ajuste perfecto y manteniendo su piel sequita y protegida."
33708,Enjuague Bucal LISTERINE® CUIDADO TOTAL Frescura Suave Sin Alcohol x500mL,427,1193.0,1193.0,4,https://www.hiperlibertad.com.ar/enjuague-bucal-listerine-cuidado-total-frescura-suave-sin-alcohol-x500ml/p,"LISTERINE® CUIDADO TOTAL Frescura Suave. 
Fórmula exclusiva con agentes antibacterianos que eliminan hasta el 99,9% de los gérmenes que causan placa, gingivitis y mal aliento en solo 30 segundos. 
La innovadora combinación de los cuatro aceites esenciales de LISTERINE® (Timol, Eucaliptol, Mentol y Salicilato de Metilo) actúa sobre las bacterias escondidas en lo más profundo de la boca.
Con flúor y Zinc activos. La protección más avanzada de la línea contra  la caries, sarro y cuidado de las encías.
Odontológicamente comprobado.

* vs solo cepillado."
34087,Enjuague Bucal LISTERINE® CUIDADO TOTAL Frescura Intensa x 250mL,427,865.99,865.99,15,https://www.hiperlibertad.com.ar/enjuague-bucal-listerine-cuidado-total-frescura-intensa-x-250ml/p,"LISTERINE® CUIDADO TOTAL Frescura Intensa. 
Fórmula exclusiva con agentes antibacterianos que eliminan hasta el 99,9% de los gérmenes que causan placa, gingivitis y mal aliento en solo 30 segundos. 
La innovadora combinación de los cuatro aceites esenciales de LISTERINE® (Timol, Eucaliptol, Mentol y Salicilato de Metilo) actúa sobre las bacterias escondidas en lo más profundo de la boca.
Con flúor y Zinc activos. La protección más avanzada de la línea contra  la caries, sarro y cuidado de las encías.
Odontológicamente comprobado.

* vs solo cepillado."
