sku,producto,categoria,precio,precio_lista,stock,url,descripcion
30241,Jabón en Polvo Lavado a Mano ALA  Core Ecolavado 3 Kg,479,1693.99,1693.99,5,https://www.hiperlibertad.com.ar/jab-n-en-polvo-lavado-a-mano-ala-core-ecolavado-3-kg/p,"En Ala sabemos que es hora de un cambio real, y por eso también estamos cambiando. Quisimos dar el próximo paso con los nuevos jabones en polvo lavado a mano Ala Core EcoLavado ¡Nueva fórmula amigable con el planeta! Imbatible contra las manchas y más sustentable. La nueva fórmula con poder de limpieza superior y agentes de limpieza naturales logra una máxima remoción de manchas, combate el mal olor y es ideal para ropa blanca y de color. Además de tener una fragancia única, es duradera. Por otro lado, su fórmula tiene ingredientes Biodegradables y agentes de limpieza de origen natural. Remueve manchas difíciles como mayonesa, helado y postre de chocolate aceite de cocina, aún en ciclos cortos de lavado. Esto disminuye el consumo de energía, contribuyendo al cuidado del medio ambiente. Encontra el jabón en polvo Lavado a Mano Ala Core Ecolavado en formato de 400 g, 800 g y 3 kg.  
Excelente ecuación de valor: efectividad/precio. ¡Proba los jabones ALA, imbatibles contra las manchas y amigables con el planeta!
Ala tiene un rol importante en ayudarnos a alcanzar nuestra visión de un futuro más sustentable. Estamos haciendo que la vida sustentable sea un conductor en todo lo que hacemos y cambie la forma en que creamos nuestros productos."
31006,Jabon Líquido SKIP  Bio-enzimas con Esencia de Comfort 3 L Doypack,480,1992.99,1992.99,73,https://www.hiperlibertad.com.ar/jabon-l-quido-skip-bio-enzimas-con-esencia-de-comfort-3-l-doypack/p,"Skip está en constante evolución para ofrecer la mejor tecnología en el lavado de la ropa. El nuevo jabón líquido Skip Bio-Enzimas con esencia de Comfort, tiene una nueva tecnología que garantiza la superioridad en la limpieza y cuidado de las fibras, asegurando un impacto positivo en el planeta.

Con enzimas de origen natural y una fórmula y fragancia biodegradable. 

La acción biológica de las enzimas de origen natural, penetra en las fibras para limpiar profundamente y prevenir que las micro-partículas de suciedad queden atrapadas, logrando un cuidado superior: previene las pelotitas, colores más vivos y duraderos, limpieza más profunda, cuida tejidos y reduce el amarillentamiento.

 
No importa cuál sea la combinación de fibras de tu ropa, con los jabones líquidos para ropa Skip Baja espuma podés obtener prendas implacablemente limpias y con su textura original preservada por mucho más tiempo. La avanzada tecnología de Skip líquido te asegura la limpieza y remoción de las manchas sin dañar las fibras de tu ropa.                          


Dosificación: Una tapa al ras (100 ml) basta para una carga completa de ropa. Vierta el producto de limpieza en el compartimento de lavado de la gaveta de su lavarropa.

Para lavado a mano utilice 1 tapa (100 ML) para una balde de agua (10 L). Para ropa muy sucia, dosifica 1 tapa y media (150 ml). Si se presentan manchas difíciles, aplique el producto directamente sobre las manchas."
28851,Jabón Liquido Baja Espuma ALA  Ecolavado Toque de Vivere 3 L DoyPack,480,1299.0,1299.0,31,https://www.hiperlibertad.com.ar/jab-n-liquido-baja-espuma-ala-ecolavado-toque-de-vivere-3-l-doypack/p,"En Ala sabemos que es hora de un cambio real, y por eso también estamos cambiando. Lanzamos los nuevos jabones líquidos Baja Espuma Ala EcoLavado Toque de VIVERE ¡Nueva fórmula amigable con el planeta! Imbatible contra las manchas y más sustentable. La nueva fórmula con poder de limpieza  superior y agentes de limpieza naturales logra una máxima remoción de manchas, combate el mal olor y es ideal para ropa blanca y de color. Además de tener una fragancia única es duradera. Su fórmula es 93% biodegradable. Remueve manchas difíciles como aceite de cocina, salsa de soja, sangre, helado y postre de chocolate, aún en ciclos cortos de lavado. Esto disminuye el consumo de energía, contribuyendo al cuidado del medio ambiente.  
Exquisita fragancia que se potencia con el uso combinado de Vivere concentrado clásico en el enjuague. ¡Ropa Limpia y Perfumada! 
Excelente ecuación de valor: efectividad/precio. ¡Probá el jabón líquido Baja Espuma Ala Ecolavado Toque de Vivere, imbatible contra las manchas y amigable con el planeta! 
Ala tiene un rol importante en ayudarnos a alcanzar nuestra visión de un futuro más sustentable. Estamos haciendo que la vida sustentable sea un conductor en todo lo que hacemos y cambie la forma en que creamos nuestros productos."
29755,Jabón Liquido Baja Espuma ALA  Ecolavado DoyPack 3 L,480,1299.0,1299.0,875,https://www.hiperlibertad.com.ar/jab-n-liquido-baja-espuma-ala-ecolavado-doypack-3-l/p,"En Ala sabemos que es hora de un cambio real, y por eso también estamos cambiando. Lanzamos  los nuevos jabones líquidos Baja Espuma Ala EcoLavado  ¡Nueva fórmula amigable con el planeta! Imbatible contra las manchas y más sustentable. La nueva fórmula con poder de limpieza superior y agentes de limpieza naturales logra una máxima remoción de manchas, combate el mal olor y es ideal para ropa blanca y de color. Además de tener una fragancia única es duradera.  Su fórmula es 93% biodegradable. Remueve manchas difíciles como  aceite de cocina, salsa de soja, sangre, helado y postre de chocolate, aún en ciclos cortos de lavado. Esto disminuye el consumo de energía, contribuyendo al cuidado del medio ambiente.  
Excelente ecuación de valor: efectividad/precio. ¡Proba los jabones ALA Ecolavado, imbatibles contra las manchas y amigables con el planeta! 
Encontra el jabón líquido Baja Espuma ALA Ecolavado en formato Doypack de 400 ml, 800 ml, 1.4 L y 3 L. ¿Qué esperas para conocerlo?                                                                                                                                                                                                                                                        
 Ala tiene un rol importante en ayudarnos a alcanzar nuestra visión de un futuro más sustentable. Estamos haciendo que la vida sustentable sea un conductor en todo lo que hacemos y cambie la forma en que creamos nuestros productos."
29301,JABON LIQUIDO SKIP PARA DILUIR BIO ENZIMAS X 500 Ml + BOTELLA REUTILIZABLE,480,1992.99,1992.99,94,https://www.hiperlibertad.com.ar/jabon-liquido-skip-para-diluir-bio-enzimas-x-500-ml-botella-reutilizable/p,JABON LIQUIDO SKIP PARA DILUIR BIO ENZIMAS X 500 Ml + BOTELLA REUTILIZABLE
30219,CREMA FACIAL CICATRICURE ACQUA DEFENSE X 50 Gr,442,1394.0,1394.0,12,https://www.hiperlibertad.com.ar/crema-facial-cicatricure-acqua-defense-x-50-gr/p,CREMA FACIAL CICATRICURE ACQUA DEFENSE X 50 Gr
27833,TAMPONES NOSOTRAS SUPER X 8 U,447,311.99,311.99,96,https://www.hiperlibertad.com.ar/tampones-nosotras-super-x-8-u/p,TAMPONES NOSOTRAS SUPER X 8 U
27773,TAMPONES NOSOTRAS MINI X 8 U,447,311.99,311.99,26,https://www.hiperlibertad.com.ar/tampones-nosotras-mini-x-8-u/p,TAMPONES NOSOTRAS MINI X 8 U
27794,TOALLAS FEMENINAS NOSOTRAS MULTIESTILO X 100 U,445,999.0,999.0,20,https://www.hiperlibertad.com.ar/toallas-femeninas-nosotras-multiestilo-x-100-u/p,TOALLAS FEMENINAS NOSOTRAS MULTIESTILO X 100 U
27822,TOALLAS FEMENINAS NOSOTRAS MULTIESTILO X 20 U,429,319.99,319.99,137,https://www.hiperlibertad.com.ar/toallas-femeninas-nosotras-multiestilo-x-20-u/p,TOALLAS FEMENINAS NOSOTRAS MULTIESTILO X 20 U
27810,TOALLAS FEMENINAS NOSOTRAS BUENAS NOCHES X 14 U,446,589.0,589.0,15,https://www.hiperlibertad.com.ar/toallas-femeninas-nosotras-buenas-noches-x-14-u/p,TOALLAS FEMENINAS NOSOTRAS BUENAS NOCHES X 14 U
30218,VINO CANCILLER CABERNET SAUVIGNON X 750 Ml,406,539.99,539.99,9,https://www.hiperlibertad.com.ar/vino-canciller-cabernet-sauvignon-x-750-ml/p,VINO CANCILLER CABERNET SAUVIGNON X 750 Ml
30962,YERBA CRUZ DE MALTA BOLDO Y MENTA SIN TACC X 500 Gr,346,432.99,432.99,4,https://www.hiperlibertad.com.ar/yerba-cruz-de-malta-boldo-y-menta-sin-tacc-x-500-gr/p,YERBA CRUZ DE MALTA BOLDO Y MENTA SIN TACC X 500 Gr
29274,YERBA CHAMIGO SIN TACC X 1 Kg,346,579.0,579.0,2,https://www.hiperlibertad.com.ar/yerba-chamigo-sin-tacc-x-1-kg/p,YERBA CHAMIGO SIN TACC X 1 Kg
30965,INFUSION A BASE DE CAFE ARLISTAN SUSTENT X 170 Gr,339,1214.99,1214.99,59,https://www.hiperlibertad.com.ar/infusion-a-base-de-cafe-arlistan-sustent-x-170-gr/p,INFUSION A BASE DE CAFE ARLISTAN SUSTENT X 170 Gr
27820,TOALLAS FEMENINAS NOSOTRAS INVISIBLE X 30 U,446,1065.0,1065.0,7,https://www.hiperlibertad.com.ar/toallas-femeninas-nosotras-invisible-x-30-u/p,TOALLAS FEMENINAS NOSOTRAS INVISIBLE X 30 U
27819,TOALLAS FEMENINAS NOSOTRAS NORMAL X 16 U,446,399.0,399.0,119,https://www.hiperlibertad.com.ar/toallas-femeninas-nosotras-normal-x-16-u/p,TOALLAS FEMENINAS NOSOTRAS NORMAL X 16 U
27793,TOALLAS FEMENINAS NOSOTRAS CLASICA X 16 U,446,250.0,250.0,80,https://www.hiperlibertad.com.ar/toallas-femeninas-nosotras-clasica-x-16-u-2/p,TOALLAS FEMENINAS NOSOTRAS CLASICA X 16 U
28315,CREMA FACIAL CICATRICURE TRICURE ANTIARRUGAS X 60 Gr,442,2433.0,2433.0,36,https://www.hiperlibertad.com.ar/crema-facial-cicatricure-tricure-antiarrugas-x-60-gr/p,CREMA FACIAL CICATRICURE TRICURE ANTIARRUGAS X 60 Gr
29841,YOGUR SER COLCHON FRUTILLA Y CHIA X 175 Gr,533,360.8,360.8,12,https://www.hiperlibertad.com.ar/yogur-ser-colchon-frutilla-y-chia-x-175-gr/p,YOGUR SER COLCHON FRUTILLA Y CHIA X 175 Gr
30365,YOGUR SER CALCIPLUS FRUTILLA Y ARANDANOS X 120 Gr,533,236.7,236.7,39,https://www.hiperlibertad.com.ar/yogur-ser-calciplus-frutilla-y-arandanos-x-120-gr/p,YOGUR SER CALCIPLUS FRUTILLA Y ARANDANOS X 120 Gr
29986,YOGUR SER CALCIPLUS DURAZNO X 120 Gr,533,236.7,236.7,27,https://www.hiperlibertad.com.ar/yogur-ser-calciplus-durazno-x-120-gr/p,YOGUR SER CALCIPLUS DURAZNO X 120 Gr
30364,YOGUR SER CALCIPLUS VAINILLA X 120 Gr,533,236.7,236.7,35,https://www.hiperlibertad.com.ar/yogur-ser-calciplus-vainilla-x-120-gr/p,YOGUR SER CALCIPLUS VAINILLA X 120 Gr
28984,YOGUR LA SERENISIMA LIGHT CON CEREALES X 157 Gr,533,226.6,226.6,36,https://www.hiperlibertad.com.ar/yogur-la-serenisima-light-con-cereales-x-157-gr/p,YOGUR LA SERENISIMA LIGHT CON CEREALES X 157 Gr
30363,YOGURISIMO VAIN TB 1000 GR,534,627.4,627.4,9,https://www.hiperlibertad.com.ar/yogur-bebible-yogurisimo-vainilla-tetra-brick-x-1-lt/p,YOGURISIMO VAIN TB 1000 GR
29840,YOGUR SER COLCHON DE MANZANA Y DURAZNO X 175 Gr,533,335.0,335.0,28,https://www.hiperlibertad.com.ar/yogur-ser-colchon-de-manzana-y-durazno-x-175-gr/p,YOGUR SER COLCHON DE MANZANA Y DURAZNO X 175 Gr
30570,POSTRE SERENITO CON CONFITES X 120 Gr,543,371.0,371.0,17,https://www.hiperlibertad.com.ar/postre-serenito-con-confites-x-120-gr/p,POSTRE SERENITO CON CONFITES X 120 Gr
28981,POSTRE SERENITO CON CHOCOBOMBAS X 110 Gr,543,371.0,371.0,15,https://www.hiperlibertad.com.ar/postre-serenito-con-chocobombas-x-110-gr/p,POSTRE SERENITO CON CHOCOBOMBAS X 110 Gr
28980,POSTRE SERENITO VAINILLA X 120 Gr,543,302.6,302.6,66,https://www.hiperlibertad.com.ar/postre-serenito-vainilla-x-120-gr/p,POSTRE SERENITO VAINILLA X 120 Gr
31264,GELATINA SERENITO FRUTILLA X 105 Gr,543,105.7,105.7,89,https://www.hiperlibertad.com.ar/gelatina-serenito-frutilla-x-105-gr/p,GELATINA SERENITO FRUTILLA X 105 Gr
30362,FLAN SERENITO X 100 Gr,544,182.6,182.6,84,https://www.hiperlibertad.com.ar/flan-serenito-x-100-gr/p,FLAN SERENITO X 100 Gr
30361,POSTRE SERENITO WAU CHOCOLATE X 100 Gr,543,182.6,182.6,160,https://www.hiperlibertad.com.ar/postre-serenito-wau-chocolate-x-100-gr/p,POSTRE SERENITO WAU CHOCOLATE X 100 Gr
29985,POSTRE SERENITO WAU VAINILLA X 100 Gr,543,182.6,182.6,116,https://www.hiperlibertad.com.ar/postre-serenito-wau-vainilla-x-100-gr/p,POSTRE SERENITO WAU VAINILLA X 100 Gr
29638,SALSA CAESAR DOS ANCLAS X 350 Gr,324,723.99,723.99,2,https://www.hiperlibertad.com.ar/salsa-caesar-dos-anclas-x-350-gr/p,SALSA CAESAR DOS ANCLAS X 350 Gr
30122,AJO DESHIDRATADO DOS ANCLAS X 20 Gr,383,184.0,184.0,14,https://www.hiperlibertad.com.ar/ajo-deshidratado-dos-anclas-x-20-gr/p,AJO DESHIDRATADO DOS ANCLAS X 20 Gr
30849,YOGUR SANCOR VIDA FRUTILLA X 1 L,534,400.0,400.0,4,https://www.hiperlibertad.com.ar/yogur-sancor-vida-frutilla-x-1-l/p,YOGUR SANCOR VIDA FRUTILLA X 1 L
30848,YOGUR SANCOR VIDA VAINILLA X 1 L,534,400.0,400.0,4,https://www.hiperlibertad.com.ar/yogur-sancor-vida-vainilla-x-1-l/p,YOGUR SANCOR VIDA VAINILLA X 1 L
30836,Toallas femeninas SIEMPRE LIBRE® Normal x8,446,339.99,339.99,34,https://www.hiperlibertad.com.ar/toallas-femeninas-siempre-libre-normal-x8/p,"Ultra suave: hecho con 70% de materiales de origen natural y sin colorantes; Hasta 100% de protección garantizada durante 6 horas ;4X veces más cápsulas de gel superabsorbente que absorben rápidamente el flujo, manteniéndolo lejos del contacto con tu cuerpo"
30837,GALLETAS CEREALITAS SALVADO 3 U X 609 Gr,342,523.0,523.0,60,https://www.hiperlibertad.com.ar/galletas-cerealitas-salvado-3-u-x-609-gr/p,GALLETAS CEREALITAS SALVADO 3 U X 609 Gr
30835,YERBA CRUZ DE MALTA TRADICIONAL SIN TACC X 1 Kg,346,946.0,946.0,23,https://www.hiperlibertad.com.ar/yerba-cruz-de-malta-tradicional-sin-tacc-x-1-kg/p,YERBA CRUZ DE MALTA TRADICIONAL SIN TACC X 1 Kg
28717,"CANASTA SOLIDA PATO CITRUS X 38,6 Gr",500,408.99,408.99,79,https://www.hiperlibertad.com.ar/canasta-solida-pato-citrus-x-38-6-gr/p,"CANASTA SOLIDA PATO CITRUS X 38,6 Gr"
28002,"CANASTA SOLIDA PATO PINO X 38,6 Gr",500,408.99,408.99,75,https://www.hiperlibertad.com.ar/canasta-solida-pato-pino-x-38-6-gr/p,"CANASTA SOLIDA PATO PINO X 38,6 Gr"
30111,"AGUA TONICA MAGNA X 1,5 Lts",26,236.0,236.0,42,https://www.hiperlibertad.com.ar/agua-tonica-magna-x-1-5-lts/p,"AGUA TONICA MAGNA X 1,5 Lts"
27571,"HOME VISION PARA TV HASTA  65""",117,65999.0,65999.0,5,https://www.hiperlibertad.com.ar/home-vision-para-tv-hasta-65/p,"Descripcion: Home para tv HASTA 65"" 2 puertas y estantes. Tiradores al tono - Color : nebraska/negro - Material: Melamina 15mm - Medidas (armado): 182 cm x 160 cm x 40 cm - Requiere armado: si - Peso Caja: 66,8 Kg"
27970,Enjuague Bucal LISTERINE® ANTISARRO Frescura Intensa x 500mL,427,1193.0,1193.0,6,https://www.hiperlibertad.com.ar/enjuague-bucal-listerine-antisarro-frescura-intensa-x-500ml/p,"LISTERINE® ANTISARRO Frescura Intensa. 
Fórmula exclusiva con agentes antibacterianos que eliminan hasta el 99,9% de los gérmenes que causan placa, gingivitis y mal aliento en solo 30 segundos. 
La innovadora combinación de los cuatro aceites esenciales de LISTERINE® (Timol, Eucaliptol, Mentol y Salicilato de Metilo) actúa sobre las bacterias escondidas en lo más profundo de la boca.
Con Zinc activo para una boca hasta 3 veces más limpia.*
Odontológicamente comprobado.
* vs solo cepillado."
30527,"YOGUR DANONINO VAINILLA X 80,5 Gr",533,164.53,164.53,119,https://www.hiperlibertad.com.ar/yogur-danonino-vainilla-x-80-5-gr/p,"YOGUR DANONINO VAINILLA X 80,5 Gr"
27961,SHAMPOO TIO NACHO DOY PACK ALOE VERA X 400 Ml,421,559.0,559.0,8,https://www.hiperlibertad.com.ar/shampoo-tio-nacho-doy-pack-aloe-vera-x-400-ml/p,SHAMPOO TIO NACHO DOY PACK ALOE VERA X 400 Ml
27778,DETERGENTE LAVAVAJILLA CIF BIOACTIVE LIMON X 500 Ml,503,349.0,349.0,237,https://www.hiperlibertad.com.ar/detergente-lavavajilla-cif-bioactive-limon-x-500-ml/p,DETERGENTE LAVAVAJILLA CIF BIOACTIVE LIMON X 500 Ml
27756,DETERGENTE LAVAVAJILLAS CIF LIMON VERDE PUMP X 750 Ml,503,746.0,746.0,30,https://www.hiperlibertad.com.ar/detergente-lavavajillas-cif-limon-verde-pump-x-750-ml/p,DETERGENTE LAVAVAJILLAS CIF LIMON VERDE PUMP X 750 Ml
33344,MOUSE VERBATIM INALAMBRICO BLACK 99765,52,2999.0,2999.0,3,https://www.hiperlibertad.com.ar/mouse-verbatim-inalambrico-black-99765/p,"El diseño contorneado con un acabado elegante y brillante se adapta cómodamente a la mano. | Conexión inalámbrica de 2,4 GHz para un rendimiento sin retrasos. | El nanorreceptor plug-and-forget conecta el mouse a la computadora portátil o PC. | 1200 DPI: proporciona un seguimiento fluido y preciso | La tecnología LED azul permite su uso en prácticamente cualquier superficie, incluidas las mesas de vidrio, los pisos de madera y las encimeras de granito, con precisión y control."
33438,MOUSE VERBATIM INALAMBRICO RED 99767,52,2499.0,2499.0,1,https://www.hiperlibertad.com.ar/mouse-verbatim-inalambrico-red-99767/p,"El diseño contorneado con un acabado elegante y brillante se adapta cómodamente a la mano. | Conexión inalámbrica de 2,4 GHz para un rendimiento sin retrasos. | El nanorreceptor plug-and-forget conecta el mouse a la computadora portátil o PC. | 1200 DPI: proporciona un seguimiento fluido y preciso | La tecnología LED azul permite su uso en prácticamente cualquier superficie, incluidas las mesas de vidrio, los pisos de madera y las encimeras de granito, con precisión y control."
29140,PAPEL HIGIENICO HIGIENOL MAX HOJA SIMPLE TECNOLOGIA PANAL 100 Mts x 4 U,516,928.99,928.99,1313,https://www.hiperlibertad.com.ar/papel-higienico-higienol-max-hoja-simple-tecnologia-panal-100-mts-x-4-u/p,PAPEL HIGIENICO HIGIENOL MAX HOJA SIMPLE TECNOLOGIA PANAL 100 Mts x 4 U
30726,YOGURISIMO FIRME  190  VAINIL,533,303.6,303.6,19,https://www.hiperlibertad.com.ar/yogur-firme-yogurisimo-vainilla-x-190-gr/p,YOGURISIMO FIRME  190  VAINIL
29147,ESPECIES SURTIDAS MOLIDAS ALICANTE X 25 Gr,383,238.0,238.0,1,https://www.hiperlibertad.com.ar/especies-surtidas-molidas-alicante-x-25-gr/p,ESPECIES SURTIDAS MOLIDAS ALICANTE X 25 Gr
27965,"YOGUR DANONINO FRUTILLA X 80,5 Gr",533,164.53,164.53,107,https://www.hiperlibertad.com.ar/yogur-danonino-frutilla-x-80-5-gr/p,"YOGUR DANONINO FRUTILLA X 80,5 Gr"
30725,POSTRE DANETTE CHOCOLATE CON CREMA X 100 Gr,543,216.1,216.1,47,https://www.hiperlibertad.com.ar/postre-danette-chocolate-con-crema-x-100-gr/p,POSTRE DANETTE CHOCOLATE CON CREMA X 100 Gr
29143,POSTRE DANETTE DULCE DE LECHE CON CREMA X 100 Gr,543,225.15,225.15,46,https://www.hiperlibertad.com.ar/postre-danette-dulce-de-leche-con-crema-x-100-gr/p,POSTRE DANETTE DULCE DE LECHE CON CREMA X 100 Gr
29124,GIN BEEFEATER BLOOD ORANGE X 700 Ml,414,5280.0,5280.0,14,https://www.hiperlibertad.com.ar/gin-beefeater-blood-orange-x-700-ml/p,GIN BEEFEATER BLOOD ORANGE X 700 Ml
27816,LIMPIADOR LIQUIDO CIF VIDRIOS Y MULTIUSO DOYPACK X 900 Ml,507,306.0,306.0,71,https://www.hiperlibertad.com.ar/limpiador-liquido-cif-vidrios-y-multiuso-doypack-x-900-ml/p,LIMPIADOR LIQUIDO CIF VIDRIOS Y MULTIUSO DOYPACK X 900 Ml
27789,Limpiador  CIF Bioactive Vidrios & Multiuso 500 ml Botella,507,359.0,359.0,79,https://www.hiperlibertad.com.ar/limpiador-cif-bioactive-vidrios-multiuso-500-ml-botella/p,Limpiador  CIF Bioactive Vidrios & Multiuso 500 ml Botella
27804,Limpiador  CIF  Bioactive Antigrasa 500 ml Doypack,507,359.0,359.0,1128,https://www.hiperlibertad.com.ar/limpiador-cif-bioactive-antigrasa-500-ml-doypack/p,Limpiador  CIF  Bioactive Antigrasa 500 ml Doypack
27754,Limpiador  CIF  Bioactive para Baño 500 ml Botella,507,359.0,359.0,97,https://www.hiperlibertad.com.ar/limpiador-cif-bioactive-para-ba-o-500-ml-botella/p,Limpiador  CIF  Bioactive para Baño 500 ml Botella
30510,VODKA ABSOLUT LIME X 700 Ml,414,4310.99,4310.99,3,https://www.hiperlibertad.com.ar/vodka-absolut-lime-x-700-ml/p,VODKA ABSOLUT LIME X 700 Ml
29569,WHISKY JAMESON X 700 Ml,416,4448.99,4448.99,14,https://www.hiperlibertad.com.ar/whisky-jameson-x-700-ml/p,WHISKY JAMESON X 700 Ml
30508,WHISKY BALLANTINES FINEST X 700 Ml,416,3899.99,3899.99,4,https://www.hiperlibertad.com.ar/whisky-ballantines-finest-x-700-ml/p,WHISKY BALLANTINES FINEST X 700 Ml
30077,ACONDICIONADOR TIO NACHO DOY PACK ALOE VERA X 400 Ml,420,559.0,559.0,9,https://www.hiperlibertad.com.ar/acondicionador-tio-nacho-doy-pack-aloe-vera-x-400-ml/p,ACONDICIONADOR TIO NACHO DOY PACK ALOE VERA X 400 Ml
29142,VINO DANTE ROBINO NAVE MALBEC X 750 Ml,406,1564.0,1564.0,16,https://www.hiperlibertad.com.ar/vino-dante-robino-nave-malbec-x-750-ml/p,VINO DANTE ROBINO NAVE MALBEC X 750 Ml
30524,VINO DANTE ROBINO NAVE CABERNET SAUVIGNON X 750 Ml,406,1564.0,1564.0,4,https://www.hiperlibertad.com.ar/vino-dante-robino-nave-cabernet-sauvignon-x-750-ml/p,VINO DANTE ROBINO NAVE CABERNET SAUVIGNON X 750 Ml
30079,VINO DANTE ROBINO NAVE BLEND DE TINTAS X 750 Ml,406,1564.0,1564.0,35,https://www.hiperlibertad.com.ar/vino-dante-robino-nave-blend-de-tintas-x-750-ml/p,VINO DANTE ROBINO NAVE BLEND DE TINTAS X 750 Ml
29591,VINO DANTE ROBINO NAVE BLEND DE BLANCAS X 750 Ml,407,1564.0,1564.0,4,https://www.hiperlibertad.com.ar/vino-dante-robino-nave-blend-de-blancas-x-750-ml/p,VINO DANTE ROBINO NAVE BLEND DE BLANCAS X 750 Ml
30523,ESPUMANTE DANTE ROBINO NAVE EXTRA BRUT X 750 Ml,409,1831.99,1831.99,10,https://www.hiperlibertad.com.ar/espumante-dante-robino-nave-extra-brut-x-750-ml/p,ESPUMANTE DANTE ROBINO NAVE EXTRA BRUT X 750 Ml
29590,ESPUMANTE DANTE ROBINO NAVE ROSADO X 750 Ml,408,1831.99,1831.99,9,https://www.hiperlibertad.com.ar/espumante-dante-robino-nave-rosado-x-750-ml/p,ESPUMANTE DANTE ROBINO NAVE ROSADO X 750 Ml
33289,FREEZER INELRO FIH 270 A++ INVERTER,101,133739.1,148599.0,3,https://www.hiperlibertad.com.ar/freezer-inelro-fih-270-a-inverter/p,"Freezer Full-4 Funciones de Frío. Nuevo tablero, Un Canasto, Ruedas Giratorias de alta resistencia, Interior en chapa pre pintada blanca, Desagote Frontal. Refrigerante R600a. Eficiencia Energética A++ - Capacidad 215 lts. - TECNOLOGIA INVERTER 60% AHORRO ENERGIA - EQUIPAMIENTO: Canasto: 1, Ruedas: SI, Puertas: 1 - ESPECIFICACIONES: Voltaje / frecuencia: 220V /50 Hz, Clase de eficiencia energética: A++, Rango de temperatura (°C): 6 /-22 - COMPONENTES: Refrigerante (libre cfc): R600a, Condensación: estática, Evaporador: Caño de Al. - Exterior gabinete: Prepintado color Blanco - Interior gabinete:  Prepintado color Blanco"
27950,GIN MALEFICIO SUNSET PINK X 500 Ml,414,1493.59,1493.59,10,https://www.hiperlibertad.com.ar/gin-maleficio-sunset-pink-x-500-ml/p,GIN MALEFICIO SUNSET PINK X 500 Ml
30512,GIN MALEFICIO SUNSET ORANGE X 500 Ml,414,1493.59,1493.59,16,https://www.hiperlibertad.com.ar/gin-maleficio-sunset-orange-x-500-ml/p,GIN MALEFICIO SUNSET ORANGE X 500 Ml
28146,GIN MALEFICIO HONEY X 500 Ml,414,1493.59,1493.59,13,https://www.hiperlibertad.com.ar/gin-maleficio-honey-x-500-ml/p,GIN MALEFICIO HONEY X 500 Ml
30511,GIN MALEFICIO DRY X 500 Ml,414,1223.99,1223.99,14,https://www.hiperlibertad.com.ar/gin-maleficio-dry-x-500-ml/p,GIN MALEFICIO DRY X 500 Ml
29644,CAPPUCCINO LA VIRGINIA TRADICIONAL FRASCO X 210 Gr,339,909.99,909.99,5,https://www.hiperlibertad.com.ar/cappuccino-la-virginia-tradicional-frasco-x-210-gr/p,CAPPUCCINO LA VIRGINIA TRADICIONAL FRASCO X 210 Gr
30851,CAPPUCCINO LA VIRGINIA VAINILLA X 155 Gr,339,538.0,538.0,22,https://www.hiperlibertad.com.ar/cappuccino-la-virginia-vainilla-x-155-gr/p,CAPPUCCINO LA VIRGINIA VAINILLA X 155 Gr
30781,CAPPUCCINO LA VIRGINIA LIGHT X 100 Gr,339,447.99,447.99,24,https://www.hiperlibertad.com.ar/cappuccino-la-virginia-light-x-100-gr/p,CAPPUCCINO LA VIRGINIA LIGHT X 100 Gr
28021,SABORIZADOR MIX DE SABOR KNORR TOMATE CEBOLLA Y MORRON X 30 Gr,329,155.99,155.99,24,https://www.hiperlibertad.com.ar/saborizador-mix-de-sabor-knorr-tomate-cebolla-y-morron-x-30-gr/p,SABORIZADOR MIX DE SABOR KNORR TOMATE CEBOLLA Y MORRON X 30 Gr
28020,MIX SABOR PARA CARNE KNORR X 4 SOBRES,329,139.99,139.99,236,https://www.hiperlibertad.com.ar/mix-sabor-para-carne-knorr-x-4-sobres/p,MIX SABOR PARA CARNE KNORR X 4 SOBRES
30141,PAÑALES BABYSEC PREMIUM XXG X 17 U,229,1123.44,1123.44,10,https://www.hiperlibertad.com.ar/pa-ales-babysec-premium-xxg-x-17-u/p,PAÑALES BABYSEC PREMIUM XXG X 17 U
30793,BOMBON OBLIBON BLANCO X 17 Gr,352,46.99,46.99,704,https://www.hiperlibertad.com.ar/bombon-oblibon-blanco-x-17-gr/p,BOMBON OBLIBON BLANCO X 17 Gr
28741,BOCADITO OBLIBON MARROC X 10 Gr,352,46.99,46.99,197,https://www.hiperlibertad.com.ar/bocadito-oblibon-marroc-x-10-gr/p,BOCADITO OBLIBON MARROC X 10 Gr
28029,BOCADITO OBLIBON CHOCOLATE BLANCO RELLENO DULCE DE LECHE X 10 Gr,352,46.99,46.99,447,https://www.hiperlibertad.com.ar/bocadito-oblibon-chocolate-blanco-relleno-dulce-de-leche-x-10-gr/p,BOCADITO OBLIBON CHOCOLATE BLANCO RELLENO DULCE DE LECHE X 10 Gr
31001,ACONDICIONADOR CAPILATIS PELO MIXTO X 420 ML,420,1026.0,1026.0,19,https://www.hiperlibertad.com.ar/acondicionador-capilatis-pelo-mixto-x-420-ml/p,ACONDICIONADOR CAPILATIS PELO MIXTO X 420 ML
35215,PORTARRETRATO FINLANDEK 20X25 SF5010,160,1099.0,1099.0,28,https://www.hiperlibertad.com.ar/portarretrato-finlandek-20x25-sf5010/p,PORTARRETRATO FINLANDEK 20X25 SF5010
35238,PORTARRETRATO FINLANDEK 13X18 SF5010,160,899.0,899.0,21,https://www.hiperlibertad.com.ar/portarretrato-finlandek-13x18-sf5010/p,PORTARRETRATO FINLANDEK 13X18 SF5010
35181,PORTARRETRATO FINLANDEK 10X15 SF5010,160,699.0,699.0,27,https://www.hiperlibertad.com.ar/portarretrato-finlandek-10x15-sf5010/p,PORTARRETRATO FINLANDEK 10X15 SF5010
35254,PORTARRETRATO FINLANDEK 20X25 SF5080,160,1099.0,1099.0,22,https://www.hiperlibertad.com.ar/portarretrato-finlandek-20x25-sf5080/p,PORTARRETRATO FINLANDEK 20X25 SF5080
35250,PORTARRETRATO FINLANDEK 13X18 SF5080,160,899.0,899.0,13,https://www.hiperlibertad.com.ar/portarretrato-finlandek-13x18-sf5080/p,PORTARRETRATO FINLANDEK 13X18 SF5080
35183,PORTARRETRATO FINLANDEK 10X15 SF5080,160,799.0,799.0,23,https://www.hiperlibertad.com.ar/portarretrato-finlandek-10x15-sf5080/p,PORTARRETRATO FINLANDEK 10X15 SF5080
31002,PAÑALES HUGGIES FLEXI COMFORT RN X 17 U,229,1534.99,1534.99,99,https://www.hiperlibertad.com.ar/pa-ales-huggies-flexi-comfort-rn-x-17-u/p,PAÑALES HUGGIES FLEXI COMFORT RN X 17 U
31157,Bebida Energizante Monster Energy VR 473 Ml,412,348.99,348.99,196,https://www.hiperlibertad.com.ar/bebida-energizante-monster-energy-vr-473-ml/p,Bebida Energizante Monster Energy VR 473 Ml
28398,GEL LUBRICANTE INTIMO PRIME SEXY ICE X 30 Gr,553,608.49,608.49,7,https://www.hiperlibertad.com.ar/gel-lubricante-intimo-prime-sexy-ice-x-30-gr/p,GEL LUBRICANTE INTIMO PRIME SEXY ICE X 30 Gr
